text,user_location,in_alaska,location_type,misinfo_keyword_flag,retrieval_similarity,retrieval_flag,misinfo_theme,misinfo_flag
"\'A discipline issue\': With vaccine deadlines passing, thousands in military remain unvaccinated https://t.co/6dMvpGyqdI via @nbcnews","Anchorage, AK",TRUE,Urban,FALSE,0.84471524,TRUE,other,TRUE
BREAKING: Jen Psaki announces that President Biden will veto any Republican resolution to remove vaccine mandates from businesses if such a bill ever makes it to his desk. RT IF YOU SUPPORT BIDEN STANDING STRONG TO SAVE AMERICAN LIVES!,"Ketchikan, AK",TRUE,Unknown,FALSE,1.1703002,TRUE,other,TRUE
"“The vaccine doesn’t really work against omicron but ofc your best bet is to get another booster anyway”   I’m telling you that mandatory vaccine has eliminated all incentive to update this broken technology, they will keep ramming it up your veins regardless. https://t.co/Qvnr9mvDRA","Shadow Moses, Alaska",TRUE,Unknown,FALSE,1.0536869,TRUE,other,TRUE
Preliminary data on Omicron and whether it escapes vaccine antibodies shows immune escape is “robust” but NOT complete- it’s partial! Reduction in nAbs was even LESS in those who had a previous infection &amp; two doses of Pfizer’s vaccine. Boosters should be able to take this on!🧵,Alaska,TRUE,Unknown,FALSE,1.0092815,TRUE,other,TRUE
When are the Republican states going to fight Biden’s vaccine mandate for airlines? Coming into the country. Etc.,"Anchorage, Alaska, USA",TRUE,Urban,FALSE,0.9197705,TRUE,other,TRUE
"200 employees fired from UMass Memorial hospital due to the vaccine mandate. But tell us more about how covid is causing a healthcare crisis, and not the liberal politicians imposing these dictates.",Bulgaria or Alaska or Texas,TRUE,Unknown,FALSE,1.0201617,TRUE,other,TRUE
\'The View\' host Sunny Hostin asks if Republicans \'want their voters to die\' during vaccine debate https://t.co/IGw3TGlEnn,"Alaska, USA",TRUE,Unknown,FALSE,1.081168,TRUE,other,TRUE
"The body of evidence for 1 vaccine shot for people with prior Covid keeps mounting, here with the T cell response data and lack of added benefit of immune response with 2 shots https://t.co/0R8FPpLz34 Just out @ScienceTM",Alaska,TRUE,Unknown,FALSE,0.9475074,TRUE,other,TRUE
LIBERAL virtues last reward in 2022  THEY/THEM tenmyouji CRYBABY clover field PRONOUN phi MOMMY MILKER myrmidon JOE BIDEN jumpydoll radical-6 VACCINE sigma klim,Anchorage,TRUE,Urban,FALSE,1.5142195,FALSE,other,FALSE
I know have a “Covid vaccine” rash on my arm &amp; the injection site looks like a middle school boy gave a hickey for the first time but I would hate myself if I got her sick,"Delta Junction, Alaska ",TRUE,Unknown,FALSE,1.0491073,TRUE,other,TRUE
"Chancellor Angela Merkel described the new restrictions as an ""act of national solidarity"" intended to break the country\'s fourth wave.  ""There should be a strict limit for all private meetings or contacts when there is an unvaccinated person,"" she said  https://t.co/gRx2TfkZJ9","Alaska, USA",TRUE,Unknown,FALSE,1.1291952,TRUE,other,TRUE
Kenya\'s Ministry of Health has vowed to intensify vaccination efforts against COVID-19 after receiving over 4.6 million doses of COVID-19 vaccine on Monday evening https://t.co/L3Jd6r3GVf https://t.co/FOm9WWlX5w,Stolen Denaʼina Lands Alaska,TRUE,Unknown,FALSE,0.9768959,TRUE,other,TRUE
BREAKING: NYC Mayor Bill de Blasio\'s vaccine mandate on the NYPD has been temporarily BLOCKED by a Manhattan court. https://t.co/647H5tqfId,"Sitka, AK",TRUE,Urban,FALSE,0.99313056,TRUE,other,TRUE
"Three doses of Pfizer-BioNTech’s Covid vaccine give significant protection against Omicron, the companies said, but two doses alone “may not be sufficient to protect against infection” by the fast-spreading variant. https://t.co/EsNTB7Jhu4 https://t.co/VAjT2vK5he","Anchorage, AK",TRUE,Urban,FALSE,1.1041666,TRUE,other,TRUE
@Stonekettle What a terribel argument on all counts Aus is pretty great also they are absolutely against the vaccine or they would have taken it. No one is forcing anyone to inject anything.,"Dena’ina Elena, Anchorage, AK",TRUE,Urban,FALSE,0.93590903,TRUE,other,TRUE
The new data from Pfizer on vaccine effectiveness against Omicron is encouraging. This reinforces what my medical advisors have been emphasizing: that boosters give you the highest protection yet.  Anyone who is eligible and has not been boosted should go get a booster today.,AK and ID,TRUE,Unknown,FALSE,1.092484,TRUE,other,TRUE
"I live in the reddest of the red states, surrounded by vehement Trump voting rabid antivax MAGAs. Vaccines are Mark of the Beast, that sort of shit, right?   My wife calling around try to get the Moderna booster? Out. Everywhere. These fucking hypocrites are ALL getting the shot","Anchorage, AK",TRUE,Urban,FALSE,0.8879187,TRUE,religious_framing,TRUE
Pfizer แจ้งผลทดลองในห้องแล็บพบว่าหากได้รับวัคซีนครบ 3 เข็ม จะมีประสิทธิภาพในการป้องกัน  Omicron ได้,"Alaska, USA",TRUE,Unknown,FALSE,1.4168365,FALSE,other,FALSE
Let me get this straight. The federal government:  -Gives Pfizer billions of $$ -Mandates Americans take their product -Prohibits Americans from suing if the product kills or injures them. -Refuses to let us see Pfizer\'s underlying data—until 2076.   And people think this is OK?,"Alaska, USA",TRUE,Unknown,FALSE,1.1795288,TRUE,other,TRUE
Senate expected to hold vote tonight to undo President Biden’s vaccine mandates,"Alaska, USA",TRUE,Unknown,FALSE,1.1511177,TRUE,other,TRUE
@Moneymirweather According to new reports. You need more boosters.  I’m no conspiracy theorist but it’s clear as day that the 1% are pushing this. Hmmmm. I wonder why? Is it the Graphene in the “vaccine” and it’s not even a vaccine clearly unless they’ve changed the definition,"Anchorage, AK",TRUE,Urban,FALSE,0.8434905,TRUE,other,TRUE
@LordofHardwired @JoJoFromJerz No worries Lord-man. We got this! No problem. Moderna rocks!,Alaska,TRUE,Unknown,FALSE,1.7963291,FALSE,other,FALSE
Bathing Bundle of Joy 🤣🤣🤣🤣🤣  Aveng Kelvin Momo Witchcraft Zahara Skhumba Lungile Russian Bear De Reuck Zwane Eskom mgodoyi Feel Good Inno G-string Lobola Pfizer https://t.co/5bGWtQG04V,Alaska Triangle,TRUE,Unknown,FALSE,1.679034,FALSE,other,FALSE
@jakescottMD What long-term studies have been done on COVID-19 vaccine safety?,"North Pole, AK",TRUE,Unknown,FALSE,0.98630345,TRUE,other,TRUE
"Oh, look: @mattbuxton has been banned for 7 days and 7 nights for live-tweeting an Anchorage Assembly testifier\'s #covid19 misinformation. For those keeping track, this has happened before: https://t.co/ujvYVQLQRN @TwitterComms https://t.co/pJs1Pnu2qT","Seward, Alaska",TRUE,Unknown,FALSE,1.3741488,FALSE,other,FALSE
"Oh, look: @mattbuxton has been banned for 7 days and 7 nights for live-tweeting an Anchorage Assembly testifier\'s #covid19 misinformation. For those keeping track, this has happened before: https://t.co/ujvYVQLQRN @TwitterComms https://t.co/pJs1Pnu2qT","Lingít Aaní - Juneau, Alaska ",TRUE,Urban,FALSE,1.3741488,FALSE,other,FALSE
I\'m betting the judge was a Trump appointee.........  Judge blocks Biden’s vaccine mandate for federal contractors https://t.co/f22N3ueqgV,"Alaska, USA",TRUE,Unknown,FALSE,1.1058824,TRUE,other,TRUE
"Vaccine researcher Peter Hotez is deeply troubled, a winter surge/omicron brewing ""I\'m not trying to change Republican or far-right thinking,"" he says ""I\'m trying to say \'The anti-science doesn\'t belong; it doesn\'t fit. Just stop it and save lives\'\'\' @NPR  https://t.co/bWHAslJT8a","Anchorage, AK",TRUE,Urban,FALSE,1.2512479,FALSE,other,FALSE
I\'m also including the FoxDie vaccine in our demands.,"Shadow Moses, Alaska",TRUE,Unknown,FALSE,0.91247845,TRUE,other,TRUE
If the vaccine was safe and effective why would congress exempt themselves from it,AK.,TRUE,Unknown,FALSE,0.82140636,TRUE,other,TRUE
A federal court blocked President Biden’s COVID-19 #VaccineMandate for federal contractors.  #Georgia and other plaintiffs suing Biden “will likely succeed in their claim that the president exceeded the authorization given to him by Congress.” https://t.co/QSihSlv44C,"Kodiak, AK.",TRUE,Unknown,FALSE,1.1641134,TRUE,other,TRUE
"200 employees fired from UMass Memorial hospital due to the vaccine mandate. But tell us more about how covid is causing a healthcare crisis, and not the liberal politicians imposing these dictates.","Alaska, USA",TRUE,Unknown,FALSE,1.0201617,TRUE,other,TRUE
"I totally believe this, given that we discovered “Omicron” last week. Sounds plausible they already conducted a study showing three shots of Pfizer is protective against it. https://t.co/MtNhZmFvKC","Sitka, AK",TRUE,Urban,FALSE,1.1838818,TRUE,other,TRUE
Pfizer wants you to get three shots now.   https://t.co/2TVIa2Surl https://t.co/2hiGm4vagC,Alaska,TRUE,Unknown,FALSE,1.426489,FALSE,other,FALSE
"@ThinkusU @POTUS Since you replied to @POTUS, I assumed you were talking about the U.S. where the government has not mandated any vaccine, although school districts and corporations have required vaccinations for a century or more. It\'s to keep people safe.","Anchorage, AK",TRUE,Urban,FALSE,0.7994051,TRUE,other,TRUE
FDA Says It Now Needs 75 Years To Fully Release Pfizer COVID-19 Vaccine Data https://t.co/Ly0PzrthR6,"Pahoehoe, AK",TRUE,Unknown,FALSE,0.9986683,TRUE,other,TRUE
DENIED https://t.co/zPRkM7u5Zb,NYC & Alaska,TRUE,Unknown,FALSE,1.7182529,FALSE,other,FALSE
"Since day one, Texas has taken a stand against the federal government\'s unconstitutional COVID-19 vaccine mandates.  We have now created a hotline for Texas employees to report illegal vaccine mandates.  The COVID-19 vaccine will always be voluntary &amp; never forced in Texas. https://t.co/OpOIjKnuGF",NYC & Alaska,TRUE,Unknown,FALSE,1.112057,TRUE,other,TRUE
The Senate has voted to repeal federal vaccine mandates.   The vote was 52-48.   All GOPers voted yea.   Sens. Jon Tester (D-MT) and Joe Manchin (D-WV) voted yea.   This now goes to the House where it will likely fail.,"Sitka, AK",TRUE,Urban,FALSE,0.9228488,TRUE,other,TRUE
BREAKING: Democratic-controlled Senate votes against Biden\'s abusive and unconstitutional vaccine mandate.,"Anchorage, Alaska",TRUE,Urban,FALSE,1.0150853,TRUE,other,TRUE
"He wants to inject you with his bio weapon six or 10 times a year. Yet, he is legally not allowed to take the poison jab! #Biontech #BoosterShots #BoosterShot #Pfizer #booster #borisjohnson #uk #england #EnoughIsEnough #Myocarditis #pericarditis #RealNotRare https://t.co/1TvmRQde67",Alaska,TRUE,Unknown,FALSE,1.2345362,FALSE,biological_safety,FALSE
"BREAKING: U.S. Senate votes 52-48 to pass a resolution to repeal President Biden\'s vaccine mandate for private employers. The bill moves to the House, where it faces an uphill battle. https://t.co/33bTBIUOkW","Goldstream, Fairbanks, Alaska",TRUE,Urban,FALSE,1.0535761,TRUE,other,TRUE
💡[Whisper]… there is actually a proven vaccine for kids age 2-4 that is *CURRENTLY UNDER REVIEW* at the @US_FDA with an EUA app submitted on November 5th—but FDA has not moved yet on approval meeting. ➡️Why is the media not talking about this? #COVAXIN https://t.co/N0PmXMEWtT https://t.co/szLEN8HQoK,Alaska,TRUE,Unknown,FALSE,0.9185902,TRUE,other,TRUE
"JUST IN - Job gone, salary gone, unemployment benefits blocked: Employers in Germany can now terminate employees ""on suspicion"" of forged vaccine passports (Focus)","Alaska, USA",TRUE,Unknown,FALSE,1.0925757,TRUE,other,TRUE
"The vaccine killed my friend last week. A 2 month decline after his 2nd pfizer shot. Heart failure and blood clots. I told him not to get it, he said ""if i die, i die."" And you did.  Rest in peace my dear friend Ian. 😑 Miss you every day. https://t.co/z5D6f17vFP","Alaska, USA",TRUE,Unknown,TRUE,0.8028296,TRUE,biological_safety,TRUE
"@rdipad @EdCove19 @MichaelPSenger @FatEmperor @chrissaccoccia1 @DrEliDavid @Lukewearechange @RWMaloneMD @bariweiss @PeterSweden7 @Humble_Analysis @RealCandaceO If you like we can go down the rabbit hole together and I can show you the studies that show obesity is absolutely a risk factor when it comes to severe disease from covid.  For me, I have made being fit a priority my whole like precisely so I don\'t have to take a shit vaccine","Juneau, Alaska",TRUE,Urban,FALSE,1.1193628,TRUE,other,TRUE
📍NOTA BENE—a “mild but faster” virus will often kill &amp; harm more people than a virus that is slower &amp; more severe. Even if just 2x more transmissible &amp; 1/10 less deadly! ➡️Folks who call #Omicron “nature’s vaccine” need to stop the public endangerment. Figure by @GosiaGasperoPhD https://t.co/f9PGtUIE8M,"Juneau, AK",TRUE,Urban,FALSE,0.9383031,TRUE,other,TRUE
My brother’s triple-jabbed - the third one was Pfizer 3-4 wks ago. He’s just got covid &amp; feels ‘rough’ &amp; is isolating. Had a Xmas meal out with a load of mates last Friday - all of them vaccinated - 17 out of 21 of them have now tested positive.,"Anchorage, AK",TRUE,Urban,FALSE,0.9652635,TRUE,other,TRUE
Joe Rogan refers to .@CNN as the right arm of Pfizer.,NYC & Alaska,TRUE,Unknown,FALSE,1.4852195,FALSE,other,FALSE
"Joe Rogan just called CNN the ""right-arm of Pfizer."" I agree 100%! They sponsor all their shows.","King Cove, Alaska",TRUE,Unknown,FALSE,1.3218083,FALSE,other,FALSE
"31 y.o. Daryl Barker from #Missouri: ""I was strongly against getting the vaccine, just because we\'re a strong conservative family. But that little boy out there is the reason to have a vaccine""   https://t.co/lO5Uq0eHXW",60 Yrs Alaska!,TRUE,Unknown,FALSE,1.0030061,TRUE,other,TRUE
"CDC\'s vaccination data may overestimate 1st vaccine doses &amp; underestimate boosters. State &amp; county data, which CDC relies on for stats, don\'t always link records of people’s boosters &amp; initial shots. A booster may be recorded as if it were a 1st dose https://t.co/Do8VP5Bz73",Alaska,TRUE,Unknown,FALSE,1.0027566,TRUE,other,TRUE
"If you\'re not vaccinated, refusing to vaccinate, and spreading misinformation about the vaccine, we can\'t be friends.","Ketchikan, AK",TRUE,Unknown,FALSE,1.1301315,TRUE,other,TRUE
"Džokej, Stephanie Gard je razvila perikarditis sa paralizom nakon Pfizer bušenja. U 19-oj godini sledi terapiju kako bi ponovo naučila da hoda i funkcioniše normalno. Nadam se da će doživotno biti zahvalna dobročinitelju, Albert Bourla-i što ju je spasao od strašnog Covida-a.🥰🥰 https://t.co/YuAa8c99N7","Juneau, AK",TRUE,Urban,FALSE,1.5619631,FALSE,other,FALSE
"mother: ""I had my booster today.""  me: ""That\'s good.""  mother: ""Moderna. Is that the one developed by a furry?""  me: ""... yes. 😬""  mother: ""Does that mean I\'m going to wake up as a fox? I\'d rather be an eagle, but I\'ll take what I can get.""","Anchorage, AK",TRUE,Urban,FALSE,1.6871017,FALSE,other,FALSE
"First bolus of Pfizer vax data from our FOIA request yields alarming adverse event findings: ""Cumulatively, through 28 February 2021 [less than three months], total of 42,086 case reports (25,379 medically confirmed and 16,707 non-medically confirmed) containing 158,893 events.","King Cove, Alaska",TRUE,Unknown,FALSE,1.037162,TRUE,other,TRUE
Dont forget that the same ppl running around saying vaccine mandates are unconstitutional bc the govt shouldnt be making medical decisions for individuals are the same ones that shut down the ENTIRE govt bc they wanted to make a medical decision for a lady named Terri Schiavo.,"In a van down by the river, AK",TRUE,Unknown,FALSE,0.88662577,TRUE,other,TRUE
Opposing vaccine mandates is the only principled position on vaccine mandates,Alaska,TRUE,Unknown,FALSE,0.81183124,TRUE,other,TRUE
"Vaccine holdouts in U.S. military approach 40,000 even as omicron variant fuels call for boosters https://t.co/U8GEVFBsvu","Alaska, USA",TRUE,Unknown,FALSE,0.9912859,TRUE,other,TRUE
"THE ""VACCINE"" DOESN\'T WORK","Alaska, USA",TRUE,Unknown,FALSE,0.5758984,TRUE,other,TRUE
"The FDA is working with the post office to hold packages containing ivermectin. The FDA could better use its resources to, I don’t know, publicly release the docs submitted by Pfizer to license its mandated liability-free V earlier than 75 years from now! https://t.co/i6eLcqnciX https://t.co/O2d1zgTjAB","Alaska, USA",TRUE,Unknown,TRUE,0.97823596,TRUE,alternative_medicine,TRUE
Amanda thought she’d never see her family again after she spent 11 days intubated in a hospital with COVID-19. Her biggest regret is not getting a COVID vaccine sooner.,Alaska,TRUE,Unknown,FALSE,1.3276339,FALSE,other,FALSE
"Joe Rogan just called CNN the ""right-arm of Pfizer."" I agree 100%! They sponsor all their shows.",ALASKA!,TRUE,Unknown,FALSE,1.3218083,FALSE,other,FALSE
@Zoso771 @DrEricDing If they said the vaccine will only keep you from not dying it would cause panic and stock markets would crash.  Rich people in charge don\'t like that.,"Anchorage, AK",TRUE,Urban,FALSE,0.7411617,TRUE,other,TRUE
JUST IN - US federal judge sides with Attorney General Wilson and blocks Biden\'s vaccine requirement for federal contractors.,ALASKA!,TRUE,Unknown,FALSE,1.0315484,TRUE,other,TRUE
"JUST IN - BioNTech CEO: Potentially upcoming vaccine for the #Omicron variant ""should be a 3-dose vaccine."" https://t.co/ounAm4Fd41",ALASKA!,TRUE,Unknown,FALSE,1.15313,TRUE,other,TRUE
"Vaccine holdouts in U.S. military approach 40,000 even as omicron variant fuels call for boosters https://t.co/U8GEVFBsvu","Utqiagvik, AK",TRUE,Unknown,FALSE,0.9912859,TRUE,other,TRUE
They are literally telling us that we must get vaccinated because omicron is vaccine resistant.,"Alaska, USA",TRUE,Unknown,FALSE,1.0295333,TRUE,other,TRUE
"Their logic: “We found this new variant that predominantly infects the vaccinated and is resistant to antibodies elicited by the vaccine. Please, go get vaccinated.  And if you’ve already been vaccinated, please go get vaccinated more.”","Anchorage, AK",TRUE,Urban,FALSE,0.97893023,TRUE,other,TRUE
Pfizer CEO received $21 million in annual compensation in 2020  Impressive!,"Anchorage, AK",TRUE,Urban,FALSE,1.3638953,FALSE,other,FALSE
"@substratenfts @quench1985 @disclosetv I mean. I get the flu shot regularly. What I experienced with the covid vaccine was wild man, my sister had to go to the ER for heart concerns after it. Both in our 20s. I’d say this vaccine is very effing intense.","Alaska, USA",TRUE,Unknown,FALSE,0.9168197,TRUE,other,TRUE
@rdipad @Lin70490427 @FatEmperor @EdCove19 @MichaelPSenger @chrissaccoccia1 @DrEliDavid @Lukewearechange @RWMaloneMD @bariweiss @PeterSweden7 @Humble_Analysis @RealCandaceO Ok. I was asymptomatic. I did test negative but lets say I was asymptomatic.  I beat it.  I am immune.  Why do I need the vaccine?  Are you telling me naturally acquired immunity is not a thing?,"Juneau, Alaska",TRUE,Urban,FALSE,0.92845464,TRUE,other,TRUE
PAANO MAKAKASAGOT ABOUT VACCINE EH NAGKANDA LECHE LECHE NGA COVID RESPONSE SATIN char,Alaska,TRUE,Unknown,FALSE,0.99070823,TRUE,other,TRUE
"@MustReadAlaska The vaccine will stop COVID, Nope. The vaccine will prevent you from spreading COVID, Nope. The vaccine will protect you from Delta, Nope. Breakthrough COVID cases are rare, Nope. Get a booster to stop Covid, Nope. If you get your 2nd booster you will vote Democrat, Probably.",Fairbanks Alaska,TRUE,Urban,FALSE,0.9747313,TRUE,other,TRUE
"@DrEricDing Moderna 2nd dose 4 weeks after 1st, not 4-5 months.",Alaska,TRUE,Unknown,FALSE,1.569792,FALSE,other,FALSE
Our now vaccinated neighbors have been kicked out of their church because someone outed their vaccine status. They are crushed and grieving.,"Juneau, AK",TRUE,Urban,FALSE,1.0599457,TRUE,other,TRUE
49-year-old Texas man who recovered from COVID—but was required to be fully vaccinated against virus before being approved for a life-saving lung transplant—died when he developed a pulmonary embolism and heart issues after his second Moderna vaccine.  https://t.co/YHCwKb2lIp,Alaska,TRUE,Unknown,FALSE,0.8883898,TRUE,other,TRUE
"Apparently half the US population and half of all #Alaskans have such a perverse, radicalized sense of entitlement and individualism they can\'t be bothered to wear a mask + get a vaccine during a pandemic that has killed over 5 million worldwide.",Alaska,TRUE,Unknown,FALSE,1.0275294,TRUE,other,TRUE
"Personal health care decisions should be up to individual Americans in consultation with their doctor, not coerced by the federal government.  This is why @Heritage is suing the Biden Administration over the vaccine mandate. https://t.co/qgcSbWHt8x","Central Fla, North Pole, AK",TRUE,Unknown,FALSE,0.98823977,TRUE,other,TRUE
"There are roughly 180,100 active-duty Marines, according to the Washington Post , and the military branch revealed on Monday that 95% of them had received at least one dose of the vaccine.  https://t.co/9qA5RX1PUw","Alaska, USA",TRUE,Unknown,FALSE,1.033226,TRUE,other,TRUE
"More STUPIDITY tried ""alternative"" cures. SMH https://t.co/bHAYMCPf1i",Alaska,TRUE,Unknown,FALSE,1.3326677,FALSE,other,FALSE
Biden\'s vaccine strategy would be a lot more effective if he hadn\'t skipped so many steps https://t.co/VmYiHEzWIE,"Anchorage, AK",TRUE,Urban,FALSE,1.0839285,TRUE,other,TRUE
State health officials are asking Alaskans to get their COVID-19 vaccine booster and redouble other precautions over the coming weeks as they brace for the arrival of the new omicron variant.  https://t.co/7AAXIOVIAF,"Sitka, Alaska",TRUE,Urban,FALSE,1.1233652,TRUE,other,TRUE
"@lowlynx @mayorcantrell @nolaready So you are telling me your vaccine doesn’t prevent you from catching Covid, it doesn’t prevent you from spreading it… what exactly does the vaccine do?","Alaska, New Mexico",TRUE,Unknown,FALSE,1.0415884,TRUE,other,TRUE
@tatereeves @FoxBusiness @TeamCavuto Make sure you completely ignore Mississippi’s horrendous infant mortality rate and the irony of “defending life” while working against life saving vaccine mandates.,"Anchorage, Alaska",TRUE,Urban,FALSE,1.2629478,FALSE,other,FALSE
Pfizer blocked Marjorie Taylor Greene on Twitter.  Georgia will block her from Congress in 2022.,"Anchorage, AK",TRUE,Urban,FALSE,1.5810419,FALSE,other,FALSE
"FYI, the morgue is so busy that nursing staff is now tasked with tagging and bagging a deceased patient in some units.(Ask me how I know.) But please… tell me more about how you don’t trust the vaccine. It definitely helps make up for the fact that we’re over here drowning.😒",Relocated Alaska Girl,TRUE,Unknown,FALSE,0.8910985,TRUE,other,TRUE
Amy Bolin said in order to be approved for a double-lung transplant her husband had to be fully vaccinated for COVID even though he had the virus and recovered. After his second Moderna shot developed a pulmonary embolism and heart condition and died before he could get new lungs,"Fairbanks, AK",TRUE,Urban,FALSE,1.0554132,TRUE,other,TRUE
"Red states are paying unemployment benefits to people who quit or are laid off after refusing vaccination.  The GOP had previously decried unemployment benefits and fought to eliminate them.  Now FL, IA, KS &amp; TN are paying people to remain unvaccinated. https://t.co/E5uyR3rs0o","Alaska, USA",TRUE,Unknown,FALSE,0.9490123,TRUE,other,TRUE
"CNBC host Jim Cramer goes on psychotic rant calling for universal vaccine mandate, enforced by the military https://t.co/dqL1TG96Z7","Alaska, USA",TRUE,Unknown,FALSE,1.1161548,TRUE,other,TRUE
Thrilled to announce that Jennifer Bridges - the strongest advocate I know for patient rights and the nurse who stood up to the @MethodistHosp vaccine mandate - is joining my team. She starts tomorrow! https://t.co/tLuLsIvkfB,"Wasilla, AK",TRUE,Unknown,FALSE,1.3302231,FALSE,other,FALSE
@freethinkerbabe I thought about tweeting “to all my vaccinated friends I am going to miss you when the vaccine gets you.” I thought better of myself,"Fairbanks, AK",TRUE,Urban,FALSE,1.1266102,TRUE,other,TRUE
The Republican attorney generals are racking up the wins in the vaccine mandate lawsuits. They\'re suing the bejesus out of the federal government and even some private employers too.,"Alaska, USA",TRUE,Unknown,FALSE,0.837415,TRUE,other,TRUE
Federal judge blocks Biden vaccine rule for health workers nationwide. That\'s how it is done!!!! #FJB,"Alaska, USA",TRUE,Unknown,FALSE,0.9806272,TRUE,other,TRUE
Federal judge blocks vaccine mandate NATIONWIDE - protects healthcare workers across America.   Source: Redpill78,"Alaska, USA",TRUE,Unknown,FALSE,0.84501886,TRUE,other,TRUE
This is some funny shit! Good riddance to bad trash.  Televangelist Marcus Lamb Who Called Vaccine Mandate \'Sin\' Against God Dies Of COVID https://t.co/LmxLtrp7w8,"Alaska, USA",TRUE,Unknown,FALSE,1.0262272,TRUE,other,TRUE
A 42-year-old British bodybuilder died from COVID-19 after he refused to get the vaccine and his family is now reflecting on what led up to his fateful death. https://t.co/6iJdEIB6mc,"Manchester, NH, Fairbanks AK",TRUE,Urban,FALSE,1.0487254,TRUE,other,TRUE
@GretaGrace20 @MysterySolvent I\'m O+ and Moderna shot 2 kicked my ass for 36 hours. Getting my booster later this month.,"Anchorage, Alaska",TRUE,Urban,FALSE,1.4686831,FALSE,other,FALSE
"Israel has identified four cases of the B.1.1.529 variant, all recent travellers. One case, a 32-year-old woman returning from South Africa, was triple vaccinated with Pfizer and had her 3rd dose just two months ago.","Anchorage, AK",TRUE,Urban,FALSE,1.129173,TRUE,other,TRUE
"Across the country, Republicans have cut unemployment benefits, claiming that these benefits pay people not to work.  Meanwhile, the same Republicans are passing laws that promise unemployment checks to vaccine refusers.  It\'s socialism for anti-vaxxers. https://t.co/1JV1WZ1usL","Anchorage, AK",TRUE,Urban,FALSE,0.9702419,TRUE,other,TRUE
