text,user_location,in_alaska,location_type,misinfo_keyword_flag,retrieval_similarity,retrieval_flag,misinfo_theme,misinfo_flag
Far right Christians: my god will protect me from the virus 😌  Also far right Christians: my god won’t be able to recognize me and allow me into heaven if I get the vaccine 😔  Me: so is your god all powerful or not??,"Alaska, USA",TRUE,Unknown,FALSE,1.2403278,FALSE,other,FALSE
"From GOP Alaska state Sen. Lora Reinbold\'s COVID-19 ""listening session"":   “Do not trust people who take Hippocratic Oath in front of double serpent,” said massage therapist Mariana Nelson. “There is something wrong about that.""  https://t.co/ClnWHt2OIb #AKleg via @lex_treinen","Anchorage, AK",TRUE,Urban,FALSE,1.3501719,FALSE,other,FALSE
"Today @CDCgov updated their website for cases and deaths by vaccine status, vaccine, and age; national data for 36% of the US population  https://t.co/HGyjNwCm0v Unvaccinated: 14-fold increased risk of death, 5.8-fold risk of infection, compared with fully vaccinated https://t.co/DSn8LEzrQJ","Portland, OR and Homer, AK",TRUE,Unknown,FALSE,0.7567017,TRUE,other,TRUE
Croatia stands up against vaccine passports. https://t.co/g27Zgzosf7,"Alaska, USA",TRUE,Unknown,FALSE,1.0554944,TRUE,other,TRUE
"About 100 Alaskans gathered at Anchorage Baptist Temple for a listening session held by several Republican legislators.   They spoke of frustrations over COVID restrictions, anger at doctors not prescribing ivermectin and conspiracies involving Dr. Fauci. https://t.co/muIUN3zu5f","Anchorage, Alaska",TRUE,Urban,TRUE,1.3665667,FALSE,alternative_medicine,TRUE
"Starting Tuesday, Nov 23, the Juneau Public Health Center is offering COVID-19 vaccines for ages 5 and up Mon - Fri, 8:30 a.m. to 4 p.m. through Dec 30, excluding holidays. Make an appointment on https://t.co/Y3I10tPGtP, call 586-6000, or simply walk in. https://t.co/OMG9kql7vX https://t.co/IdJp5FixQf","Lingít Aaní - Juneau, Alaska ",TRUE,Urban,FALSE,1.1598759,TRUE,other,TRUE
President Biden’s proposed #VaccineMandate for private employers will put over 44 million jobs at risk and cost firms nearly $1.3 billion to comply. https://t.co/XToKllbWCz,"Alaska, USA",TRUE,Unknown,FALSE,0.85536885,TRUE,other,TRUE
"I submitted this FOIA request to the FDA: they now claim it will take them 55 years to release the data on which Pfizer\'s vaccine approval was based, though it only took them 108 days to review this data for the approval process. Details here…  https://t.co/fINNRXKeiT","Alaska, USA",TRUE,Unknown,FALSE,1.1052066,TRUE,other,TRUE
@finaldrafted @chryyan @RetiredOldGuy1 @PatBurkeNY mRNA technology is definitely not new.,Alaska,TRUE,Unknown,FALSE,1.5299056,FALSE,other,FALSE
"@saltynightnurse @VP Being against an experimental injection full of garbage does not make us anti-vaxxers, it makes us intelligent in the fact that we will rely on our natural immunity to defend us. Seems to be an awful lot of people developing problems and dying after taking this ""vaccine""","Fairbanks, Alaska",TRUE,Urban,TRUE,0.84953547,TRUE,alternative_medicine,TRUE
2. Major corporate contributors to the sponsors of Ohio\'s extreme abortion ban:  @Nationwide  @GetSpectrum  @firstenergycorp  @GM  @DukeEnergy  @pfizer  @AnthemInc  @UnitedHealthGrp  @JNJNews (Johnson &amp; Johnson) @ATT   https://t.co/7phhdy5eaF,"Anchorage, AK",TRUE,Urban,FALSE,1.3707025,FALSE,other,FALSE
@JuddLegum @mattsheffield Sure am glad not to see Moderna there.,Alaska,TRUE,Unknown,FALSE,1.8176385,FALSE,other,FALSE
"Last Thanksgiving there was no vaccine and it was not safe for families to celebrate. This year, 80% of Americans have had at least one shot and millions are traveling to see loved ones. That’s the difference between Biden and Trump. #DemocratsDeliver",AK and ID,TRUE,Unknown,FALSE,0.9146451,TRUE,other,TRUE
"When I’m Governor of Colorado, there will be NO COVID-19 vaccine mandates or business closures.",AK.,TRUE,Unknown,FALSE,1.0835027,TRUE,other,TRUE
"CBJ – in partnership with Juneau Public Health Center, @BartlettHosp, @JuneauSchools, local pediatricians, and other community orgs – is hosting free pediatric Pfizer vaccine clinics for all Juneau youth ages 5-11 Mon, Nov 29; Tue, Nov 30; and Sat, Dec 4. https://t.co/y1EpMxcAvq https://t.co/Y5B8zJezhe","Lingít Aaní - Juneau, Alaska ",TRUE,Urban,FALSE,1.1264896,TRUE,other,TRUE
"@T_Nenninger si les gens n\'ont toujours pas compris que Deray, Lacombe, Marty, Barbier, Veran, Macron etc. racontent tout ce qu\'il leur passe par la tête pour caser du Pfizer, c\'est qu\'ils ont un problème bien plus grave que le covid....","Alaska, USA",TRUE,Unknown,FALSE,1.6775916,FALSE,other,FALSE
@P3zlo @franceinfo Vaccine toi si tu veux élever le niveau,"Fairbanks, AK",TRUE,Urban,FALSE,1.2833264,FALSE,other,FALSE
"Last Thanksgiving there was no vaccine and it was not safe for families to celebrate. This year, 80% of Americans have had at least one shot and millions are traveling to see loved ones. That’s the difference between Biden and Trump. #DemocratsDeliver","Alaska, USA",TRUE,Unknown,FALSE,0.9146451,TRUE,other,TRUE
คนที่ได้รับวัคซีนครบแล้ว ได้ mRNA ด้วย แถมแข็งแรงมาตลอด ส่วนใหญ่อาการน้อยมาก พักเยอะๆ หายไวแน่ๆค่ะ    พวกเราก็เป็นกลจ.ให้น้องกันเยอะๆนะคะ ทุกคนเป็นห่วงมากๆแหละ แต่อย่าลืมดูแลสุขภาพกายสุขภายใจของตัวเองด้วย ✌🏻,"Alaska, USA",TRUE,Unknown,FALSE,1.6906303,FALSE,other,FALSE
BREAKING REPORT: ATA Announces 2.5 million truckers TO QUIT OVER VACCINE MANDATE if Biden doesn\'t reverse course..,"Alaska, USA",TRUE,Unknown,FALSE,1.1037611,TRUE,other,TRUE
@LCI @DabWilliam @DariusRochebin On a le droit de contaminer les autres que si on est vacciné… Le gars y a un « Pr » devant son nom quand même… Utiliser le mot « droit » en plus… ce naufrage…🤦🏻‍♂️,"Alaska, USA",TRUE,Unknown,FALSE,1.5294499,FALSE,other,FALSE
"@jdobalina @NicoleB_MD The menu analogy to explain how mRNA can\'t alter DNA.   ✅The menu = DNA ✅Your food order = mRNA ✅Chef making the food = proteins  Your order (mRNA) cannot change your menu (DNA)! Also, the order (mRNA) gets thrown out pretty quickly, so unlikely to make long-term side effects! https://t.co/AphUbYZtCm",Alaska,TRUE,Unknown,FALSE,1.2222103,FALSE,other,FALSE
FDA Wants 55 Years to Produce Data That Led to ‘Warp Speed’ Licensing of Pfizer Comirnaty Vaccine • Children\'s Health Defense🙄🙄🙄 Sounds Reasonable!!! https://t.co/pLKqAIVPjE,"Alaska, USA",TRUE,Unknown,FALSE,1.0508461,TRUE,other,TRUE
"GLOBAL EXCLUSIVE: A Small Group of International Banks, Working With Pfizer, Successfully Executed A Planetary Coup Against The Nation-State  https://t.co/7O74dVayRp",Alaska,TRUE,Unknown,FALSE,1.3113561,FALSE,other,FALSE
It was never about your health.    https://t.co/fTDcTV28ou,"Florida, w/Alaska on my mind",TRUE,Unknown,FALSE,1.4418278,FALSE,other,FALSE
"It\'s not too late to get a flu shot. Stay healthy during the flu season and get your annual (once-a-year) flu vaccine. The vaccine can reduce flu illnesses, missed work, and doctor’s office visits. So, if you haven’t yet received your flu shot, schedule an appointment today. https://t.co/M711Gas62p","AK, WA, ID, OR ",TRUE,Unknown,FALSE,1.3738666,FALSE,other,FALSE
Does anyone know how to get a new copy of your Covid vaccine card? I kept mine in my wallet and it’s falling apart,"Juneau, AK",TRUE,Urban,FALSE,1.1640921,TRUE,other,TRUE
It might be just an aversion to litigation as there is no statute of limitations for murder. Might be. (Pfizer petition for keeping trial data under wraps for 53 years.) https://t.co/1OmbokLkrB,"Mount Redoubt, Alaska USA",TRUE,Unknown,FALSE,1.41372,FALSE,other,FALSE
"Dr. Mike Yeadon, former Pfizer VP, responds to a Ron DeSantis video https://t.co/E8VUHs3FZX","Wasilla, AK",TRUE,Unknown,FALSE,1.5586684,FALSE,other,FALSE
"I\'m twice vaccinated but I sympathize with antivaxism. Mandatory Covid vaccine is unnecessary. If we\'re alive, we already have been exposed to Covid and developed natural immunity. Mandatory vaxism is an Ideological conquest, a metaphysical genocide, and parasite in biden\'s brain","Wasilla, AK",TRUE,Unknown,TRUE,0.9294599,TRUE,alternative_medicine,TRUE
Received an e-mail from my pediatrician’s office today.  They are looking for 6 month olds to enroll in a Covid-19 vaccine trial on behalf of Meridian Clinical Research.  Just in case you thought Big Pharma evil was done…  Just wait til they come for your infants with mandates!,"Anchorage, AK",TRUE,Urban,FALSE,1.1715062,TRUE,institutional_distrust,TRUE
Fallen Angels Cast from the Heavens  $PYPL: -37% $TWTR: -38% $SNAP: -38% $TWLO: -41% $COUP: -44% $FTCH: -48% $MRNA:-48% $RNG: -49% $DKNG:-50% $upst:-50% $PINS: -50% $ROKU: -51% $ZM: -56% $BABA: -56% $z: -59% $TDOC: -60% $CRSP: -61% $PENN: -61% $FSLY: -65% $BYND: -67% $PTON: -70% https://t.co/hQoscFBnAO,"Bethel, AK",TRUE,Rural,FALSE,1.6696306,FALSE,other,FALSE
"The Occupational Safety and Health Administration is following the stay issued by the 5th Circuit Court of Appeals, it said on its website, and is temporarily not enforcing the COVID-19 federal vaccine mandate on private employers. https://t.co/fdPAZ59F5x","Alaska, USA",TRUE,Unknown,FALSE,1.0385447,TRUE,other,TRUE
BREAKING REPORT: Navy Shipbuilding Contractor [Huntington Ingalls Industries] SUSPENDS VACCINE MANDATE After Workers Threaten to Leave...,"Alaska, USA",TRUE,Unknown,FALSE,1.0539643,TRUE,other,TRUE
@h2_Lo My local Walmart pharmacy is handing them out like any other vaccine they provide. 🤷‍♀️,"Craig, Alaska",TRUE,Unknown,FALSE,0.9059632,TRUE,other,TRUE
15 years old. Given Moderna. Cerebral hemorrhage/Cerebral ventricular rupture/Death https://t.co/9CFi7E6xNW,"Juneau, AK",TRUE,Urban,FALSE,1.6176976,FALSE,other,FALSE
"As hospitals in Europe fill with unvaccinated #COVID19 patients, rage is rising against them -- not only because their #vaccine refusal prolongs the #pandemic, but because it denies care to those suffering other serious ailments. https://t.co/Kg0wMqNWqh","Anchorage, AK",TRUE,Urban,FALSE,0.95556974,TRUE,other,TRUE
The FDA \'updated\' Pfizer\'s reported vaccine deaths in clinical trials. It\'s raising serious concerns. https://t.co/Wpte8Yv1lQ,"Sitka, AK",TRUE,Urban,FALSE,0.88733757,TRUE,other,TRUE
Biden Regime Ignores Courts Again and Tells Businesses to Move Forward with Vaccine Mandate https://t.co/ISfcitUU68,"Alaska, USA",TRUE,Unknown,FALSE,1.0736063,TRUE,other,TRUE
My five year-old son just got his first vaccine dose.  He didn’t cry.  He didn’t complain.  He didn’t even wince.  He is braver than any anti-vaxxer I know.  So fucking proud of him.,"Alaska, USA",TRUE,Unknown,FALSE,1.0267905,TRUE,other,TRUE
No line for a vaccine booster at the Anchorage Airport… 2nd level. #OpenToAll https://t.co/CV3iCMTOHm,"Anchorage, Alaska",TRUE,Urban,FALSE,1.097967,TRUE,other,TRUE
Trump Republicans and alt-righters have already turned on Glenn Youngkin — calling him a RINO because he refused to outlaw local mask and vaccine mandates in Virginia and has a LGBTQ staff member.,The AK Rowdy,TRUE,Unknown,FALSE,1.4618793,FALSE,other,FALSE
My five year-old son just got his first vaccine dose.  He didn’t cry.  He didn’t complain.  He didn’t even wince.  He is braver than any anti-vaxxer I know.  So fucking proud of him.,The AK Rowdy,TRUE,Unknown,FALSE,1.0267905,TRUE,other,TRUE
"We regret to inform you that Eric Clapton is at it again. What an unwarranted attack on Eric. 🤬🤬🤬🤬Independent thinking is “frowned upon”. I got the Pfizer jabs, and I still got a pretty intense case of Covid. Thank God for monoclonal antibodies. https://t.co/A9tmPIFsJT","Alaska, USA",TRUE,Unknown,FALSE,1.3325448,FALSE,other,FALSE
BREAKING REPORT: Navy Shipbuilding Contractor [Huntington Ingalls Industries] SUSPENDS VACCINE MANDATE After Workers Threaten to Leave...,"Ketchikan, Alaska",TRUE,Unknown,FALSE,1.0539643,TRUE,other,TRUE
@POTUS Perhaps we can appeal to gun enthusiasts by allowing doctors to administer the vaccine via dart gun. lol,"Seward, AK",TRUE,Unknown,FALSE,1.0290737,TRUE,other,TRUE
Anyone who downplays the threat of the anti-vaccine movement is either not paying attention or has been bamboozled.,"Anchorage, AK    Merida, YUC",TRUE,Urban,FALSE,1.0006038,TRUE,other,TRUE
My five year-old son just got his first vaccine dose.  He didn’t cry.  He didn’t complain.  He didn’t even wince.  He is braver than any anti-vaxxer I know.  So fucking proud of him.,"Ketchikan, AK",TRUE,Unknown,FALSE,1.0267905,TRUE,other,TRUE
"""We conclude that the mRNA vacs dramatically increase inflammation on the endothelium and T cell infiltration of cardiac muscle and may account for the observations of increased thrombosis, cardiomyopathy, and other vascular events following vaccination."" https://t.co/ft6Ike37ze","Alaska, USA",TRUE,Unknown,FALSE,0.82627773,TRUE,other,TRUE
".@TRUCKINGdotORG\'s president said the administration was warned.  ""If you’re trying to solve the supply chain problem, you’re actually compounding it and actually hurting the very problem you’re trying to fix.""  https://t.co/VvIQhbxnfU","Alaska, USA",TRUE,Unknown,FALSE,1.4042077,FALSE,other,FALSE
@ZeeJayThorne Very cold was literally my only symptom with the first two Pfizer doses!,"Alaska, USA",TRUE,Unknown,FALSE,1.4169542,FALSE,other,FALSE
Imagine a virus so deadly that most people talk about the vaccine injuries and deaths instead.,"Juneau, AK",TRUE,Urban,FALSE,0.82167196,TRUE,other,TRUE
This is definitely disturbing.  We have as many cases and hospitalizations in #NH now as we did a year ago before vaccine. And everyone is like business as usual. https://t.co/mhFKWe7GVF,"Manchester, NH, Fairbanks AK",TRUE,Urban,FALSE,0.9479439,TRUE,other,TRUE
Huge anti lockdown / vaccine passport / mandates protests:  - France🇫🇷 - Switzerland🇨🇭 - Italy🇮🇹 - Austria🇦🇹 - Germany🇩🇪 - Netherlands🇳🇱 - Canada🇨🇦 - USA🇺🇸 - Belgium🇧🇪 - Australia🇦🇺 - Czech Rep🇨🇿 - New Zealand🇳🇿  And many others. Which the media ignores. https://t.co/JHdv2XY6m0,"Anchorage, AK",TRUE,Urban,FALSE,0.9836788,TRUE,other,TRUE
"Q: What’s the difference between Pfizer, Moderna, and Rittenhouse?  A: Rittenhouse’s shots are effective.",Alaska ,TRUE,Unknown,FALSE,1.4529995,FALSE,other,FALSE
"BREAKING: 195 House Republicans, as well as all 50 Republican senators, support nullifying Biden’s federal vaccine mandate",AK.,TRUE,Unknown,FALSE,1.0483363,TRUE,other,TRUE
"If you are voluntarily showing a vaccine passport to eat in a restaurant, go to a concert, or enter a gym, you are part of the problem.","Juneau, Alaska",TRUE,Urban,FALSE,0.9143795,TRUE,other,TRUE
"NEW - Dr. Fauci says babies, toddlers could be eligible for the #COVID19 vaccine in the U.S. by early 2022, but he ""can\'t guarantee it"" (Insider)","Alaska, USA",TRUE,Unknown,FALSE,1.0488904,TRUE,other,TRUE
"We are in for a tumultuous few months. Vaccine failure in Europe and U.S. is becoming harder and harder to dismiss. Officials will respond like wounded animals, snarling and snapping at all who come near. We can expect intense scapegoating of the unvaxxed, particularly children.","Juneau, AK",TRUE,Urban,FALSE,0.85542,TRUE,other,TRUE
@LesGara_InAK Did they have Pfizer or Moderna?,"Chugiak, AK",TRUE,Unknown,FALSE,1.6267436,FALSE,other,FALSE
"WATCH: Vaccine mandate protest in Perth, Australia   https://t.co/Dhy3suiWy1","Juneau, AK",TRUE,Urban,FALSE,0.9194205,TRUE,other,TRUE
🚨 Joe Biden’s vaccine mandates are UNCONSTITUTIONAL!   Sign &amp; take back America!  ⬇️⬇️⬇️⬇️ https://t.co/as5ONdyQJi,AK.,TRUE,Unknown,FALSE,1.0065377,TRUE,other,TRUE
Navy Shipbuilder Backpedals On Vaccine Mandate After Flood Of Employees Threaten To Quit https://t.co/ZC6q7aLJkn,"Juneau, AK",TRUE,Urban,FALSE,0.9997157,TRUE,other,TRUE
Received an e-mail from my pediatrician’s office today.  They are looking for 6 month olds to enroll in a Covid-19 vaccine trial on behalf of Meridian Clinical Research.  Just in case you thought Big Pharma evil was done…  Just wait til they come for your infants with mandates!,"Juneau, AK",TRUE,Urban,FALSE,1.1715062,TRUE,institutional_distrust,TRUE
"@nicnac_14 Personal Freedom, EUA, Pfizer dishonesty, side effect dishonesty, Media dishonesty, and I saw segregation and separation. To take the shot might blind me to the pain and experiences of my fellow travelers. What is happening now is unconstitutional. #Iwillnotcomply",Alaska,TRUE,Unknown,FALSE,1.2508588,FALSE,freedom_language,FALSE
Abstract 10712: Mrna COVID Vaccines Dramatically Increase Endothelial Inflammatory Markers and ACS Risk as Measured by the PULS Cardiac Test: a Warning | Circulation https://t.co/WGwwWPfesK,"Alaska, USA",TRUE,Unknown,FALSE,0.79923475,TRUE,other,TRUE
I dont think you can blame the new Covid Variant on anti-vaxxers exclusively.  Pfizer and Moderna could have absolutely released the patents to accelerate vaccine distribution worldwide.  Blame capitalism too.,Alaska to Texas to Missouri,TRUE,Unknown,FALSE,0.9510493,TRUE,other,TRUE
"Since this tweet is getting some attention, wanted to share a website that has actual vaccine facts. Factual facts. Facty facts. Facts that are truly facts. And that’s a fact.   https://t.co/J8sjFqgU8F","Homer, Alaska",TRUE,Unknown,FALSE,0.9793,TRUE,other,TRUE
Something to give thanks for.  Here is a site where those that either have COVID longhauler symptoms or lasting vaccine-induced damage can register and receive diagnostic and treatment care.  https://t.co/ldWmk9FVGd,"Alaska, USA",TRUE,Unknown,FALSE,1.0040617,TRUE,other,TRUE
"The Biden vaccine mandate is so urgent, it had to wait until January   The travel ban is so urgent, it can wait until Monday   Covid is so dangerous, we can mask up in between bites on the plane  When will people have finally had enough of this?","Sitka, AK",TRUE,Urban,FALSE,0.9879441,TRUE,other,TRUE
"I’ll raise you one: BY THE TIME YOU DETECT ONE VARIANT ANOTHER IS ALREADY CIRCULATING UNDER THE RADAR SOMEWHERE SO WITH A MIX OF SURVEILLANCE LAGS, LOW VACCINE UPTAKE, INEQUITABLE VACCINE ACCESS WE ARE WILL BE CHASING VARIANTS ENDLESSLY.   (my first all caps tweet) https://t.co/UJtgN6zpoO","Dena\'ina Ełnena~ Anchorage, AK",TRUE,Urban,FALSE,1.0038651,TRUE,other,TRUE
"1/2 Re: Omicron, we’ll learn a lot in the next w weeks, if not sooner: 1. Whether antibodies in those vaccinated (including our vaccine) cross neutralize the virus/pseudovirus with the omicron spike. 2. Those experiments will also examine added benefits of boosters, also","Ketchikan, AK",TRUE,Unknown,FALSE,0.95867157,TRUE,other,TRUE
@YaGirlAlex__ By all means I\'m not anti vaccine at all but there is a agenda with covid. I\'m not to sure a specifics but I\'m tired of just being label crazy/conspiracy theroist when I\'m just being a free thinker and not being spoon fed what the media tells me,Alaska,TRUE,Unknown,FALSE,0.8635912,TRUE,other,TRUE
"Who else thinks the pandemic would be over FASTER if it wasn\'t for anti-mask, anti-vaccine COVID deniers? ✋","Anchorage,Alaska ",TRUE,Urban,FALSE,0.78978467,TRUE,other,TRUE
"Hoping Americans would die, Russia spend millions trying to persuade gullible Americans not to get vaccinated. The propaganda campaign worked too well—now its own people are reluctant to save their lives, too.  https://t.co/bKIFFjpBZa","Anchorage, AK",TRUE,Urban,FALSE,0.9677,TRUE,other,TRUE
"@WalshFreedom The zombie followers of DJT forgot he pushed the vaccine &amp; had his entire Family vaccinated (Vaccines are ""okay"" said the orange man). But now that Biden is in the Oval Office, they would rather die &amp; kill others, out of ignorant spite. Political Pitfall, ""two"" many Parties USA.",Wasilla Alaska,TRUE,Unknown,FALSE,1.000721,TRUE,freedom_language,TRUE
"Part of what makes Fox News so distressing is the incoherence. ""The variant is fake, but Trump would already have a new vaccine for it, but vaccines don\'t work."" Anyone who can accept all of those together—millions of Fox News viewers—is impervious to reason. They\'re in a cult. https://t.co/hv32HGZ9MX","Anchorage, Alaska",TRUE,Urban,FALSE,1.0332513,TRUE,other,TRUE
From one of the chief creators of the #Moderna vaccine  #GetVaccinated #VaccinateTheWorld #WearAMask https://t.co/TORWlveyXw,"Alaska, USA",TRUE,Unknown,FALSE,1.0165195,TRUE,other,TRUE
"Great news! Pfizer say that within 100 days it can rework their current vaccine to combat the new variant. So once you’ve had your double jab, plus your booster, you can then schedule your omicron fourth-but-definitely-not-final jab.   🤡🤡🤡🤡🤡🤡🤡🤡🤡🤡🤡🤡","Wasilla, AK",TRUE,Unknown,FALSE,1.2196529,FALSE,other,FALSE
"Who else thinks the pandemic would be over FASTER if it wasn\'t for anti-mask, anti-vaccine COVID deniers? ✋","Juneau, AK",TRUE,Urban,FALSE,0.78978467,TRUE,other,TRUE
"Similar stuff is going back and forth over vaccine claims - I saw some claim that South Africa has only 7% of its population vaccinated, and that\'s because the US is hoarding vaccines for boosters. I don\'t think that\'s true! 4/",Anchorage,TRUE,Urban,FALSE,0.9744369,TRUE,other,TRUE
"This new variant stuff is all so bleakly predictable and so sad. Months and months ago doctors/scientists in Africa were raising the alarm about unequal vaccine distribution and how it would affect the whole world, not just individual countries","Anchorage, AK",TRUE,Urban,FALSE,0.86132073,TRUE,other,TRUE
Be double sure to get vaccinated for the new variant that is vaccine resistant,"Bulchitna, Alaska",TRUE,Unknown,FALSE,1.0318915,TRUE,other,TRUE
#EnoughIsEnough We need vaccine requirements for all flights.,"Juneau, AK",TRUE,Urban,FALSE,1.0164516,TRUE,other,TRUE
"Great news! Pfizer say that within 100 days it can rework their current vaccine to combat the new variant. So once you’ve had your double jab, plus your booster, you can then schedule your omicron fourth-but-definitely-not-final jab.   🤡🤡🤡🤡🤡🤡🤡🤡🤡🤡🤡🤡",Alaska & Idaho,TRUE,Unknown,FALSE,1.2196529,FALSE,other,FALSE
"Even though I’m fully vaccinated with Moderna and already scheduled for my booster, I’ll continue to socially distance and wear a mask because the deadly pandemic is far from over and I want to do my part to help save lives. How about you? ✋","Ketchikan, AK",TRUE,Unknown,FALSE,0.91602135,TRUE,other,TRUE
@Rothbard1776 If it were.. and you were say.. Pfizer.. I guess you’d want to push the idea the variant popped up somewhere not a lot of people were vaccinated with your said vaccine.. something like say..Africa?,"Juneau, AK",TRUE,Urban,FALSE,0.82098854,TRUE,other,TRUE
"So no matter how you try to make sense of it, there are two deaths in the FDA document that aren\'t accounted for in the Pfizer paper, and there is some math that leads to five excess deaths in the vaccine group whereas I can only discern how to get 1 or 5 excess deaths from paper","Palmer, Alaska",TRUE,Unknown,FALSE,0.74273634,TRUE,other,TRUE
"That is, the excluded deaths in the Pfizer paper are 1 HIV in each group and then 3 vaccine 2 placebo. The HIV cancel out. If FDA were counting the 2 placebo group deaths as vaccinated because they occurred after the vaccination of the placebo group, that\'s five excess deaths.","Palmer, Alaska",TRUE,Unknown,FALSE,0.8654133,TRUE,other,TRUE
"Anyone have any idea why the FDA counts 9 more deaths from the Pfizer trial between dose 1 and March 13, 2021 than Pfizer counts in its paper?  https://t.co/azeQEMr6EV https://t.co/LhISuxedrG","Palmer, Alaska",TRUE,Unknown,FALSE,1.1140661,TRUE,other,TRUE
"""We fear the new variant will be vaccine resistant. So go get your booster quickly!""  2021: When logic died.","Palmer, Alaska",TRUE,Unknown,FALSE,1.0417962,TRUE,other,TRUE
https://t.co/c2F7lY6t8a,"Alaska, USA",TRUE,Unknown,FALSE,1.7186749,FALSE,other,FALSE
"Por fim, são econômicos ou nulos quando o tema é ajuda humanitária de vacinas, respiradores, aparelhos de UTI, assistência médica e técnica etc. Cuba, que sofre o mais duro bloqueio econômico da história moderna, fez mais em ajuda humanitária que toda União Europeia!",Starship Alaska,TRUE,Unknown,FALSE,1.5068021,FALSE,other,FALSE
"Pssst...with cases of the Omicron variant being detected outside of Africa in places like the UK, Hong Kong, Belgium and Israel, maybe we should focus less on travel bans and more on ending the harsh global vaccine inequity which leads to variants like Omicron in the first place?","Homer, Alaska",TRUE,Unknown,FALSE,1.1593122,TRUE,other,TRUE
"So let’s imagine that a virus can circulate around the globe for over a year without mutating. Then upon research, development and distribution of a “vaccine” In record time,from multi vendors mind you we’ve blown through half the Greek alphabet in 11months. Keep blaming pure bld https://t.co/vjWjIRyFyd","Anchorage, AK",TRUE,Urban,FALSE,1.3210921,FALSE,other,FALSE
"There will be no COVID Zero, no Delta Zero and no variants Zero. We have a vaccine. Get it. Mask if you want. Mitigate. Time to move on. Lockdowns and school closures are no longer necessary or warranted. Learning to live with the endemic is necessary.",Alaska,TRUE,Unknown,FALSE,1.0470852,TRUE,other,TRUE
Recall that Botswana bought 500k doses from Moderna for ~$29 per dose—far more than what even wealthy countries paid. Doses were expected to arrive in Aug. but none had been delivered by Oct.  Perhaps allowing corporations to call the shots in a global emergency was a bad idea. https://t.co/qubShjF8ld,"Fairbanks, AK",TRUE,Urban,FALSE,1.2538271,FALSE,other,FALSE
