text,user_location,in_alaska,location_type,misinfo_keyword_flag,retrieval_similarity,retrieval_flag,misinfo_theme,misinfo_flag
Very disappointing. Never forget that Mitch McConnell moved heaven and earth to save the Democrats and fund all of Biden’s tyrannical vaccine mandates. https://t.co/WMNZrp3a71,"Alaska, USA",TRUE,Unknown,FALSE,1.0964774,TRUE,other,TRUE
"World record-holder in static breath-hold freediving, veteran triathlete, professional tennis player, professional mountain biker—all high-performing athletes until COVID vaccines ruined their health + their careers.  #TheDefender: https://t.co/zL66Edfiw5  https://t.co/L76vBedOOW","Alaska, USA",TRUE,Unknown,FALSE,1.1685134,TRUE,other,TRUE
"No wonder Big Pharma doesn’t want liability and have 55 years to release documents; the jabbed will be dead by then🚨  Over 42,000 Adverse Reaction Reports Revealed In First Batch Of Pfizer Vax Docs  https://t.co/2gp0oqCksS","Alaska, USA",TRUE,Unknown,FALSE,1.1143544,TRUE,institutional_distrust,TRUE
Mike Lee and fellow Republicans are fighting to stop government vaccine mandates. If only they had this much fight in protecting our kids from school shootings.,"Juneau, AK",TRUE,Urban,FALSE,0.78334975,TRUE,other,TRUE
How can the GOP call themselves pro-life when they are anti-vaccine?,Alaska,TRUE,Unknown,FALSE,0.9371189,TRUE,other,TRUE
"@JeffHerndon33 @mwilson0079 @BrandonLBradfor @philthatremains @andyaschmidt @frankthorp NO!  Fauci and the talking bobble heads from the govt. and from DC Think Tanks ALL said that with the vaccine, masks would no longer be needed and the country could open up, they\'re just moving the goal posts now!! #BranchCovidians","Anchorage, AK ✈",TRUE,Urban,FALSE,0.9228134,TRUE,other,TRUE
My husband\'s hospital just suspended their vaccine mandate!!!!  👏👏👏👏👏,Alaska,TRUE,Unknown,FALSE,1.0953509,TRUE,other,TRUE
BREAKING: Oklahoma sues Biden administration over Pentagon vaccine mandate.,Alaska,TRUE,Unknown,FALSE,1.1450754,TRUE,other,TRUE
BREAKING: Joe Manchin Says He May Join GOP in Defunding Biden’s Vaccine Mandate,Alaska,TRUE,Unknown,FALSE,1.1813618,TRUE,other,TRUE
Unvaccinated Nevada State Workers To Pay Monthly Insurance Surcharge | HuffPost Latest News https://t.co/3xGxfDJ9u4,"Ca, Co, NY, Fl, Ak, USA",TRUE,Unknown,FALSE,1.2695177,FALSE,other,FALSE
Biden administration says COVID vaccine requirements for domestic flights not ‘off the table’ | Just The News https://t.co/hQw2EK23ei,"Ketchikan, Alaska",TRUE,Unknown,FALSE,1.0301651,TRUE,other,TRUE
i saw this person i went to high school with on my Instagram talking about how they still ‘can’t trust what’s in the vaccine’ so i reminded them about the time in 10th grade when he voluntarily ate a sharpie.,"Anchorage, AK",TRUE,Urban,FALSE,0.9564266,TRUE,other,TRUE
They’re going to try and get it in us one way or another.  https://t.co/pVEZl3MEtf,"Alaska, USA",TRUE,Unknown,FALSE,1.4219636,FALSE,other,FALSE
"@freedomcaucus @RepChipRoy @SenMikeLee Thank you for standing up for the craziness regarding OSHA and CMS mandates. I grewup when the war on drugs, remeber hearing that drug dealers were corrupt and evil people. Is it possible we can speak honestly about the criminal acts of the vaccine manufacturers? Followthefines.","Anchorage, Alaska",TRUE,Urban,FALSE,0.91487646,TRUE,freedom_language,TRUE
@Surgeon_General What have long term safety studies of this vaccine shown?,"North Pole, AK",TRUE,Unknown,FALSE,0.8474065,TRUE,other,TRUE
"Joanie Bily, chief workforce analyst for Employbridge, says Biden\'s vaccine mandate is a ""challenge"" for businesses and is ""holding people back."" https://t.co/Y07CR341qR",Alaska,TRUE,Unknown,FALSE,0.8408115,TRUE,other,TRUE
"Twitter has slapped an ""unsafe link"" warning on a study from the American Heart Association which found that mRNA vaccines dramatically increase risk of developing heart diseases from 11% to 25%. https://t.co/KpTEFF0jUq",Alaska,TRUE,Unknown,FALSE,0.79001653,TRUE,other,TRUE
*ACTUALLY* the bill\'s guardrails ensure the federal gov\'t (read: Biden) can\'t use ARP money to repurpose IIS databases for any other purpose (like enforcing vaccine mandates or creating federal passports).,DC | Alaska | San Diego,TRUE,Unknown,FALSE,1.2486532,FALSE,other,FALSE
"H.R. 550 isn’t at all related to a federal vaccine database or vaccine passports. In fact, the bill actually increases security, bolsters cyber defense, and helps better protect Americans’ health privacy.",DC | Alaska | San Diego,TRUE,Unknown,FALSE,0.9646152,TRUE,other,TRUE
"I don\'t know who needs to hear this, but Breitbart has completely misrepresented this bill. H.R.550 - the Immunization Infrastructure Modernization Act does NOT create a federal vaccine database. 🧵 https://t.co/cg6uQUI0eP",DC | Alaska | San Diego,TRUE,Unknown,FALSE,0.8789768,TRUE,other,TRUE
Reuters: U.S. SENATE DEFEATS REPUBLICAN AMENDMENT TO STRIP FUNDING FOR VACCINE MANDATE ENFORCEMENT FROM BILL FUNDING GOVERNMENT,"Anchorage, AK",TRUE,Urban,FALSE,1.0714228,TRUE,other,TRUE
"World Bank President David Malpass: “Pfizer has been hesitant to go into some of the countries because of the liability problems, they don’t have a liability shield.”   Why so hesitant Pfizer? They are safe…right? https://t.co/SGeBZPJdli","North Pole, AK",TRUE,Unknown,FALSE,1.185775,TRUE,other,TRUE
Cleveland Clinic Suspends Vaccine Mandate After The Gateway Pundit Exposed Hospital\'s \'Heinous\' COVID Malpractice https://t.co/DcPaiQ5E3U,"Fairbanks, AK",TRUE,Urban,FALSE,1.0062222,TRUE,other,TRUE
Vaccine Mandates: What The F**K Is Going On In Australia??! https://t.co/Trm1Zu1bHG via @YouTube,Alaska,TRUE,Unknown,FALSE,0.93759227,TRUE,other,TRUE
VACCINE VIRUS https://t.co/jeZFrx4A33,"Sitka, AK",TRUE,Urban,FALSE,0.8290093,TRUE,other,TRUE
"So vaccine mandates are an infringement of personal freedom, but abortion bans aren\'t?","Anchorage, AK",TRUE,Urban,FALSE,0.8414906,TRUE,freedom_language,TRUE
The doctor’s office when I go in for my ninth covid vaccine booster shot. https://t.co/n4bQM6kCtC,"Alaska, USA",TRUE,Unknown,FALSE,1.2215028,FALSE,other,FALSE
"I am not against the people who’ve gotten the vaccine. I welcome them with open arms. If you got one dose and don’t want a second, we welcome you. If you got two and don’t want a third, we welcome you.  If you got all three and want more, we also welcome you. Will you welcome us?","Palmer, Alaska",TRUE,Unknown,FALSE,0.7870606,TRUE,other,TRUE
"BREAKING REPORT: More than 10,000 Australians have filed coronavirus vaccine injury claims...  MEDIA SILENT...",alaska,TRUE,Unknown,FALSE,0.97774947,TRUE,other,TRUE
"BREAKING: Alabama, Arizona, Georgia, Idaho, Indiana, Louisiana, Mississippi, Montana, Oklahoma, South Carolina, Utah and West Virginia will sue Biden over vaccine mandate 🇺🇸",Alaska,TRUE,Unknown,FALSE,1.064643,TRUE,other,TRUE
Oh man. I\'ve been stuck in a writing bubble all day and just saw that the Sixth Circuit got the big vaccine case. That\'s not good.,Alaska,TRUE,Unknown,FALSE,1.0246615,TRUE,other,TRUE
"Pfizer’s data shows the mRNA &amp; subsequent spike protein are distributed in the body within hours. This is a problem, as spike protein IS A TOXIN causing cardiovascular and neurological damage. Once in your blood circulation, spike protein can cause platelets to clump together. https://t.co/KJztTafiJa",S.E. Alaska,TRUE,Unknown,TRUE,0.9890697,TRUE,biological_safety,TRUE
It’s an unbelievably heavy burden to interview vaccine injured people/people whose loved one passed away after the vaccine multiple times a week. But I refuse to stop because I am absolutely disgusted at the denial and gaslighting and the fact that this product is being mandated.,"Alaska, USA",TRUE,Unknown,FALSE,0.87429726,TRUE,other,TRUE
"""The U.S. Chamber of Commerce, the nation’s biggest business lobby, is urging employers to follow the Biden administration’s coronavirus vaccine requirements.""  https://t.co/xTNHOwPFn9",Alaska,TRUE,Unknown,FALSE,0.9821352,TRUE,other,TRUE
"To those who think Biden has done nothing: $1400 stimulus checks, additional unemployment benefits, child tax credits, increased earned income credit, nutrition assistance, housing aid, vaccine distribution and testing, implementing procedures for safe schools, housing aid 1/",Alaska,TRUE,Unknown,FALSE,1.6467583,FALSE,other,FALSE
Recruiting the former FDA director to serve on the board of Pfizer seems to have worked out well for Pfizer.,"Alaska, USA",TRUE,Unknown,FALSE,1.2303821,FALSE,other,FALSE
"FDA expected to authorize Pfizer booster for all adults this week: The FDA is expected to authorize Pfizer\'s Covid booster for all adults this week. A CDC advisory committee, ACIP, will meet on Friday to discuss boosters. https://t.co/GrsXyCZfC0","Alaska, USA",TRUE,Unknown,FALSE,1.3375895,FALSE,other,FALSE
Here’s the thread from December of 2020 when I discovered the @CDCgov was lying about vaccine efficacy for prior infected. I called the DC CDC Director who brought in one of their top scientists. They said I was right and they would fix it. They have never corrected the lie. https://t.co/uwpQbpDijX,"Alaska, USA",TRUE,Unknown,FALSE,0.95224273,TRUE,other,TRUE
"""You\'ve been at Fox TV too long!""  @JoyVBehar and @JedediahBila locked horns on #TheView after Bila explained why she chose not to get the Covid-19 vaccine. https://t.co/lniAy0jsOi","Alaska, USA",TRUE,Unknown,FALSE,1.1732721,TRUE,other,TRUE
Rockmond Dunbar Exits ‘9-1-1’ Over Covid Vaccine Mandate After Pursuing Medical &amp; Religious Exemptions https://t.co/WXK3kofgtr via @Deadline,"Alaska, USA",TRUE,Unknown,FALSE,1.174258,TRUE,religious_framing,TRUE
@wolfe_herb @lucta63 @AP I believe people have the right to choose what they want or dont want. And it’s that simple Jack. Want a vaccine get it. Don’t want it? Then don’t it shouldn’t matter to you or anyone else what you decide on.,"North Pole, AK",TRUE,Unknown,FALSE,0.86954653,TRUE,other,TRUE
BREAKING REPORT: OSHA Suspends Enforcement of Vaccine Mandate After Most Recent Court Ruling...,"Alaska, USA",TRUE,Unknown,FALSE,0.8566375,TRUE,other,TRUE
Nearly one-third of adults in the US still aren\'t vaccinated. Stories of people struggling with long Covid show how dangerous the virus can be. The best way to prevent long Covid is to get vaccinated. https://t.co/fJCYlyXrar,Alaska,TRUE,Unknown,FALSE,1.0228086,TRUE,other,TRUE
"The suspects were members of a Telegram group chat consisting of tens of thousands of citizens titled ""Basta Dittatura,"" meaning ""Enough of the Dictatorship.""   The police launched the investigation due to alleged threats originating from the chat.  https://t.co/5cfKkmP7xR","Alaska, USA",TRUE,Unknown,FALSE,1.4058375,FALSE,other,FALSE
BREAKING REPORT: OSHA Suspends Enforcement of Vaccine Mandate After Most Recent Court Ruling...,"Ketchikan, Alaska",TRUE,Unknown,FALSE,0.8566375,TRUE,other,TRUE
JUST IN - Sweden withdraws recommendation to exclude vaccinated people from testing. Vaccine passports are required for 100+ people indoor events from December 1.,"Alaska, USA",TRUE,Unknown,FALSE,1.1525671,TRUE,other,TRUE
Biden administration will invest billions to expand coronavirus vaccine manufacturing https://t.co/yaLaOYCVaM,"Anchorage, AK",TRUE,Urban,FALSE,1.009859,TRUE,other,TRUE
PARALYZED AFTER HEP B VACCINE... - https://t.co/JCg9G2j4az,Alaska,TRUE,Unknown,FALSE,1.0105466,TRUE,other,TRUE
PARALYZED AFTER HEP B VACCINE... - https://t.co/V37cO3O4vB,"Anchorage, Ak",TRUE,Urban,FALSE,1.0138887,TRUE,other,TRUE
PARALYZED AFTER HEP B VACCINE... - https://t.co/0VNKnlSNOl,"Alaska, USA",TRUE,Unknown,FALSE,1.0418265,TRUE,other,TRUE
"“I think most businesses don’t want the intervention that was delivered first by the federal government,” said Lee.  Gov. @BillLeeTN signed into law a sweeping measure to ban #VaccinePassports and restrict the enforcement of #MaskMandates in #Tennessee. https://t.co/f5Era9oYaV","Alaska, USA",TRUE,Unknown,FALSE,0.9216434,TRUE,other,TRUE
"The Turin prosecutor’s office directed police raids in several Italian cities of people thought to be involved with protests against the Green Pass, Italy’s domestic coronavirus vaccine passport. https://t.co/H3JUy37iaK","Alaska, USA",TRUE,Unknown,FALSE,1.0847509,TRUE,other,TRUE
"Shortly after a US appeals court rejected a challenge by the Biden administration, @OSHA_DOL suspended the enforcement of the #VaccineMandate for private businesses. https://t.co/XFnvPpH1zf","Alaska, USA",TRUE,Unknown,FALSE,0.9632838,TRUE,other,TRUE
"Pfizer, BioNTech, and Moderna are set to earn $34 billion in profit this year from their vaccines alone.  That works out to $93.5 million a day, $65,000 a minute, and more than $1,000 every second in profit.  https://t.co/atCzHKgsAd","Alaska, USA",TRUE,Unknown,FALSE,1.0617347,TRUE,other,TRUE
Que tal vacinarmos os ministros do supremo?? 3 doses de Pfizer + 2 de Moderna + 2 Atrazeneca resolvem a parada!,"Alaska, USA",TRUE,Unknown,FALSE,1.46646,FALSE,other,FALSE
"Great piece on the many federal, state and local legal challenges to vaccine mandates  https://t.co/4fFdi9gYpK","King Cove, Alaska",TRUE,Unknown,FALSE,0.88285756,TRUE,other,TRUE
"I May Get To Continue Working To Pay For — Higher Cost Of Living, Illegals’ $2,400+ Monthly Stipend, For Corrupt Politicians’/“Individuals’”Skims/Scams, And Communism!  Breaking — OSHA suspends Biden’s Vaccine Mandate… Will comply with 5th Circuit order… https://t.co/YSBUxUnfSa","Alaska,South Central",TRUE,Unknown,FALSE,1.5219369,FALSE,other,FALSE
I hope Phizer is right about that 89%... #COVID19 https://t.co/E3gfUChKOi,"Anchorage, AK",TRUE,Urban,FALSE,1.1934183,TRUE,other,TRUE
"Companies should cease implementation of Biden’s OSHA vaccine mandate, because OSHA itself has ceased.  OSHA website: “OSHA has suspended activities related to the implementation and enforcement of the Emergency Temporary Standard”  https://t.co/Hu1xBcwSoZ https://t.co/lcOfZ0BVs3","Anchorage, Alaska",TRUE,Urban,FALSE,1.0709462,TRUE,other,TRUE
"@GrowingJohnsons Take COVID19, for example. Republicans have turned this into a ""wedge"" issue! A disease is a political issue!! And, these COVID19 antivaxxers are mostly vaxxed for other diseases. The disease--the vaccine--these are not real issues. They\'re contrived. And ""the flock"" eats it up.","Anchorage, AK",TRUE,Urban,FALSE,1.0132396,TRUE,other,TRUE
"‼ JUST IN: PENTAGON SAYS NATIONAL GUARD MEMBERS REFUSING #COVID19 VACCINE ""MAY JEOPARDIZE"" THEIR STATUS  Pentagon spox John Kirby says ""Governors may not relieve individual members of the Guard from their obligation to comply"" with vaccine mandate. Statement ⬇⬇  @OKCFOX https://t.co/xpRG24QNcn","Alaska, USA",TRUE,Unknown,FALSE,0.940531,TRUE,other,TRUE
"OSHA (the Labor Department’s Occupational Safety and Health Administration) has suspended the enforcement of the Biden administration’s #Covid_19 vaccine mandate for private businesses, following 5th Circuit Court opinion that it\'s “staggeringly overbroad” https://t.co/cXuRm9Lx8X","Alaska, USA",TRUE,Unknown,FALSE,1.0477375,TRUE,other,TRUE
"BREAKING: Alabama, Arizona, Georgia, Idaho, Indiana, Louisiana, Mississippi, Montana, Oklahoma, South Carolina, Utah and West Virginia will sue Biden over vaccine mandate 🇺🇸","Ketchikan, Alaska",TRUE,Unknown,FALSE,1.064643,TRUE,other,TRUE
"@AxelSavage4 Read “Demon in the Freezer” by Richard Preston. After the Cold War, many vials of smallpox went missing. The US also tossed its vaccine supply because the disease had supposedly been eradicated and it cost $250K/yr to refrigerate it.",Alaska,TRUE,Unknown,FALSE,1.1894671,TRUE,other,TRUE
Answer: Officials want a new flu vaccine. https://t.co/pB8OBbhlEb,"Alaska, USA",TRUE,Unknown,FALSE,0.7975255,TRUE,other,TRUE
They are just making fun of us now.   FDA Asks Federal Judge to Grant it Until the Year 2076 to Fully Release Pfizer’s COVID-19 Vaccine Data #VaccineMandates #Covid_19 #vaccine @7SealsOfTheEnd @still_a_nerd @TuckerCarlson @seanhannity @marklevinshow https://t.co/sycpQbrz0K,"Alaska, USA",TRUE,Unknown,FALSE,0.8907193,TRUE,other,TRUE
"guess who was just granted a religious exemption from the China injection + got a 15% raise today 😎 that’s correct I did what a great day, nice to put this whole vaccine charade in the past","Kenai, AK",TRUE,Unknown,FALSE,1.0567762,TRUE,religious_framing,TRUE
Pentagon warns National Guard troops could be forced out for vaccine refusal after Oklahoma rejects mandate https://t.co/PWdDVHhImi  I guess the Guard in all 50 states needs to be controlled by DOD and not the Governors of the states,"Anchorage,Alaska ",TRUE,Urban,FALSE,1.1118774,TRUE,other,TRUE
".@realDailyWire Co-CEO @JeremyDBoreing\'s update on Biden\'s vax mandate: ""Until the 6th circuit or Supreme Court rules otherwise, the OSHA mandate is now off. No vaccine requirement, no testing requirement, no masks, no fines, nothing. You don\'t have to do anything. So don\'t."" https://t.co/Vjx7IAbWUf","Fairbanks, Alaska",TRUE,Urban,FALSE,1.0899076,TRUE,other,TRUE
@exceedhergrasp1 I had a similar experience with the Johnson and Johnson vaccine. Made me feel better than I had in years,"Salcha, Alaska",TRUE,Unknown,FALSE,0.8538153,TRUE,other,TRUE
.@glennbeck discussing the vaccine arms race on @BlazeTV special on the cover-up of the creation of the virus https://t.co/rbJp0VXeKY,Alaska,TRUE,Unknown,FALSE,1.007256,TRUE,other,TRUE
Here are the vaccine providers in Juneau that currently offer the Pfizer pediatric COVID-19 vaccine for ages 5-11:  • Genoa Healthcare • Juneau Public Health Center • Juneau Urgend &amp; Family Care • SEARHC\'s Ethel Lund Medical Center  Learn more here: https://t.co/sVbM85cfu0 https://t.co/WEld3uNMi8,"Juneau, AK",TRUE,Urban,FALSE,1.1992009,TRUE,other,TRUE
🤫🤫🤫🤫🤫 https://t.co/pwpwRyVkJB,Alaska,TRUE,Unknown,FALSE,1.7817568,FALSE,other,FALSE
"When multiple parties sue a federal agency in different appeals courts, a special judicial panel consolidates the cases and selects one court to hear them all.1 And how is that done? By power ball. #osha #vaccinemandate https://t.co/JWWTvERAeN",Anchorage Alaska,TRUE,Urban,FALSE,1.4631169,FALSE,other,FALSE
The FDA wants the public to wait until the year 2076 - a full 55 years - for them to release the information it relied on to deem Pfizer\'s vaccine safe for usage.  They said they can release 500 pages a month for the next 659 months.  That makes me want to see the data right now.,"North Pole, AK",TRUE,Unknown,FALSE,1.082381,TRUE,other,TRUE
Alaska Railroad vaccine clinic honors a longtime engineer who died from COVID-19 https://t.co/eQWXRFhcvU,"Anchorage, Alaska",TRUE,Urban,FALSE,1.0298635,TRUE,other,TRUE
Elon Musk Set To Create New Company ‘Tesla Pharmaceuticals’ To Research and Develop New ‘Safer’ COVID-19 Vaccine https://t.co/rao4ZNPLkK,"Alaska,South Central",TRUE,Unknown,FALSE,1.1570804,TRUE,other,TRUE
OSHA suspends vaccine mandate for employees - https://t.co/QcGriBGW8A #OANN,Alaska,TRUE,Unknown,FALSE,0.9680629,TRUE,other,TRUE
FDA Asks Federal Judge to Grant it Until the Year 2076 to Fully Release Pfizer’s COVID-19 Vaccine Data  https://t.co/Y0K7U3CRjo https://t.co/jp8ReTvnfo,"Alaska, USA",TRUE,Unknown,FALSE,1.031244,TRUE,other,TRUE
The FDA wants 55 YEARS to fully release documents and data that was used for the approval of the Pfizer vaccine. I mean you dont want to f up the stock price and profit margins until as much money as possible is made. Im sure its all on the up and up folks. Carry on.,Alaska,TRUE,Unknown,FALSE,1.0587236,TRUE,other,TRUE
Here are the vaccine providers in Juneau that currently offer the Pfizer pediatric COVID-19 vaccine for ages 5-11:  • Genoa Healthcare • Juneau Public Health Center • Juneau Urgend &amp; Family Care • SEARHC\'s Ethel Lund Medical Center  Learn more here: https://t.co/sVbM85cfu0 https://t.co/WEld3uNMi8,"Juneau, Alaska",TRUE,Urban,FALSE,1.1992009,TRUE,other,TRUE
FDA Asks Federal Judge to Grant it Until the Year 2076 to Fully Release Pfizer’s COVID-19 Vaccine Data - by Aaron Siri -  🤯🤯🤯 https://t.co/b1JoEYrC7Y,"Wasilla, AK",TRUE,Unknown,FALSE,1.0680995,TRUE,other,TRUE
Here’s ⁦@marclesterphoto⁩ with a story that’ll make you cry.  https://t.co/QcULYeltri,"Washington, DC / Anchorage",TRUE,Urban,FALSE,1.7359347,FALSE,other,FALSE
BREAKING: Biden Administration in Full Retreat: Federal Vaccine Mandate is Now *Suspended* Due to ‘Onslaught of Legal Challenges’  https://t.co/7LpglBEmTl,"Juneau, AK",TRUE,Urban,FALSE,0.96922874,TRUE,other,TRUE
Rockmond Dunbar Exits ‘9-1-1’ Over Covid Vaccine Mandate After Pursuing Medical &amp; Religious Exemptions https://t.co/WXK3kofgtr via @Deadline,Alaska,TRUE,Unknown,FALSE,1.174258,TRUE,religious_framing,TRUE
เกาหลีใต้งดฉีด Moderna ให้คนที่อายุต่ำกว่า 30ปี แนะนำให้ฉีด Pfizer แทนและสำหรับคนที่ฉีด Moderna เข็มแรกแล้วเข็มสองแนะนำให้ฉีด Pfizer เนื่องจากมีความเป็นไปได้สูงที่จะเกิดโรคกล้ามเนื้อหัวใจอักเสบในผู้ที่อายุต่ำกว่า 30 ปีค่ะ นอกจากนี้เกาหลีจะใช้ AZ ถึงแค่สิ้นปีนี้เท่านั้นค่ะ https://t.co/JL4ANOVVIQ,"Uşak, Türkiye",TRUE,Unknown,FALSE,1.6842871,FALSE,other,FALSE
"@akheriaty I went to the hospital with chest pains after my first vaccine and explained I was worried it might be myocarditis… nurse turns to me and says “We’ve had lots of people coming in with chest pains since taking the vaccine, but there’s definitely no link between the two”… 🤦🏻‍♂️","Palmer, Alaska",TRUE,Unknown,FALSE,0.8068284,TRUE,biological_safety,TRUE
"If this in true, if health care professionals are being disciplined for talking about possible vaccine injuries, then one must suspect that the true number of vaccine injuries is under reported. https://t.co/pakBSq1qVV","Juneau, AK",TRUE,Urban,FALSE,0.88447046,TRUE,other,TRUE
This should make #TFG happy! He can stage more Covid-blowing parties. https://t.co/PxvUZ546MV,"Dunleavy Gulch, Alaska",TRUE,Unknown,FALSE,1.3912754,FALSE,other,FALSE
"As more children get vaccinated, a slow return to ""normal"" is finally giving families a much needed feeling of relief. https://t.co/JWpL6GPO9f","Anchorage, AK",TRUE,Urban,FALSE,0.98448396,TRUE,other,TRUE
"@kylegriffin1 It is probable that the vaccine provides defence against this new variant. It exhibits many characteristics to the delta variant. It may be more mobile and this means the unvaccinated are at greater risk. Our biggest problem isn’t the variant, it remains the unvaccinated","Alaska, USA",TRUE,Unknown,FALSE,1.041148,TRUE,other,TRUE
National Police Association opposes vaccine mandates for police even though Covid is responsible for 71% of officer deaths this year. Now they’re framing “anti-police” sentiment as the major threat to their safety and telling people to “stop filming” them? https://t.co/UL5NahjLuj https://t.co/NyemaCmCYB,"Manchester, NH, Fairbanks AK",TRUE,Urban,FALSE,0.98907864,TRUE,other,TRUE
"In January 2020, Moderna stock was $19 a share... it\'s $329 today.  That\'s all you need to know.","Alaska, USA",TRUE,Unknown,FALSE,1.6175003,FALSE,other,FALSE
@SheriAWilkinson Got my Moderna booster on Wednesday and my arm is still sore .. I think it’s kind of a normal thing though.,"Anchorage, AK",TRUE,Urban,FALSE,1.4847037,FALSE,other,FALSE
"There will always be a new variant because the networks are financed by Pfizer ads, and politicians love the checks they get from big pharma lobbyists. Politicians love how they don\'t have to pass laws with democracy, they just give decrees.","Alaska, USA",TRUE,Unknown,FALSE,1.0969435,TRUE,institutional_distrust,TRUE
@tfmdsepcr @jellenp @MilitaryTimes Yes. The polio vaccine took at least 7 years to develop and be approved. The smallpox vaccine took decades. COVID took less than one year. That’s not very “lengthy and bureaucratic” to me.,Alaska,TRUE,Unknown,FALSE,1.0551052,TRUE,other,TRUE
@unusual_whales Would the vaccine help with 30 spike protein mutations?,"Anchorage, AK",TRUE,Urban,TRUE,0.7436602,TRUE,biological_safety,TRUE
This is why we need vaccine equity. COVID will never stop if we don’t prioritize vaccinations in developing countries  https://t.co/NNRHrgcNZP,"Anchorage, AK",TRUE,Urban,FALSE,0.7254014,TRUE,other,TRUE
"Hoard vaccine, manufacture vaccine inequity, create conditions for emergence of variants, then ban and isolate. https://t.co/gRMCu9qimT",dena\'ina ełnena alaska,TRUE,Unknown,FALSE,0.7136531,TRUE,other,TRUE
"@denise_dewald @ROB_4u1 @POTUS @CDCgov A 32 year old who received her 3rd dose of Pfizer 2 months ago just tested + for the new variant. The vaccine alone approach failed to work due to new variants, just like @DrEricDing warned, while explaining the importance of combining vaccines WITH widespread use of airborne PPE https://t.co/yQ5BAXdIRz https://t.co/HSNeZIoWst","Alaska, USA",TRUE,Unknown,FALSE,1.0874082,TRUE,other,TRUE
@drippy2hard Started using stops and it\'s working cashed out right at the top of mrna and ain\'t loosing to much on,"Alaska, USA",TRUE,Unknown,FALSE,1.4217694,FALSE,other,FALSE
"11/X Fortunately, it’s pretty fast to tweak &amp; test our existing #COVID19 #vaccines for #Omicron or another #covidvariant. In fact, #vaccine developers have been planning for this possibility for a long time because viruses are well-known to evolve. https://t.co/21Fe1t4iDH",Alaska,TRUE,Unknown,FALSE,1.0807623,TRUE,other,TRUE
