text,user_location,in_alaska,location_type,misinfo_keyword_flag,retrieval_similarity,retrieval_flag,misinfo_theme,misinfo_flag
"This is strong. Thank you Oklahoma Natl Guard &amp; OK Governor. “Until a guardsman is activated under Title 10, they follow the lawful commands of the governor of the state of Oklahoma, who has not mandated the [COVID-19] vaccine for Oklahoma Guard members,”  https://t.co/8qyBdrviUO","Juneau, AK",TRUE,Urban,FALSE,1.2123895,FALSE,other,FALSE
"@SleepyLowis @NanaRoRo30 🤣🤣🤣 I went on a Häagen-Dazs chocolate peanut butter binge after my Pfizer booster. 😁 (also, beware ten-year-olds who like to play slug bug) 😆","Anchorage, AK",TRUE,Urban,FALSE,1.5891715,FALSE,other,FALSE
"Guess I won the vax-lottery (AZ+Moderna). But now, which booster should I take? Another Moderna so I\'m matched up (for travel considerations?) https://t.co/eLVqDePypO","Vancouver, BC + TX, AK, PA, AB",TRUE,Unknown,FALSE,1.5763714,FALSE,other,FALSE
@adndotcom If only they didn’t rescind the vaccine mandate. 🤷‍♂️  Humans before politics.   https://t.co/WAosqgE3eK,"Alaska, USA",TRUE,Unknown,FALSE,0.7904414,TRUE,other,TRUE
@AlainMartin458 Tu peux juste répondre à la question Alain ? Pourquoi le non vacciné est un criminel ?,"Alaska, USA",TRUE,Unknown,FALSE,1.3952031,FALSE,other,FALSE
"@LunaIssy @leeloojbesson Problem is so many ... folks ... have absolutely no clue what a vaccine is, what mumps or measles or rubella are, what small pox is, or what polio is. Ebola made a splash.  So when a ""Brand New"" virus comes along (and they will) folks get even more stupid than usual,","Anchorage, AK",TRUE,Urban,FALSE,0.96832216,TRUE,other,TRUE
I know more people with serious adverse reactions to the vaccine than COVID-19.,"Alaska, USA",TRUE,Unknown,FALSE,0.8851676,TRUE,other,TRUE
"More vaccine passport countries now seeing big rises in cases: France, Italy, Portugal.  Why is it that the more evidence we get about how useless vaccine passports are, the greater is the pressure to extend vaccine-based restrictions?","King Cove, Alaska",TRUE,Unknown,FALSE,0.82511187,TRUE,other,TRUE
A FEATURE https://t.co/dKBVu6JsA9 PRESENTATION  OSHA Suspends Enforcement of Vaccine Mandate After Court Block Randy Purham II / Candidate for US Congress for Alaska / https://t.co/4Bd9jGOqup / @RPURHAM  TECS® on Rumble: https://t.co/IQpu2SupId https://t.co/8SdsuC4OZ2,"Anchorage, AK",TRUE,Urban,FALSE,1.1315049,TRUE,other,TRUE
@mtmikey11 @2B7C89526 @DavidBCollum Reported deaths after getting the COVID vaccine. https://t.co/aoZrq9ygbt,"Alaska, USA",TRUE,Unknown,FALSE,1.0351961,TRUE,other,TRUE
"FDA asks federal judge to grant it until the year 2076 to fully release Pfizer’s Covid-19 vaccine data. So, the gov’t mandates Pfizer’s product, grants it immunity for injuries, and wants to hide its safety data for 55 years. Who does the gov’t work for? https://t.co/wT2egkT9Wm","Anchorage, AK",TRUE,Urban,FALSE,0.926298,TRUE,other,TRUE
Breaking right now..(FDA ) asks court for (55) yrs to fully release all the data it has on Pfizer regarding the Vax... ANY QUESTIONS,"Aleutian islands, Alaska",TRUE,Unknown,FALSE,1.2646508,FALSE,other,FALSE
"In 55 years I’ll consider using the Pfizer vaccine , I’ll be 101 years old , vaccine should easily help me get to 102 .","Aleutian islands, Alaska",TRUE,Unknown,FALSE,1.104815,TRUE,other,TRUE
"Alaska Railroad vaccine clinic pays tribute to an engineer who died of COVID. David Harris regretted not getting the shot, a close friend said, and planned to share his experiences with co-workers. “It’s just sad that he didn’t get the chance to do that.” https://t.co/34ipi1Em4J https://t.co/maORvP1ad8","Anchorage, Alaska, USA",TRUE,Urban,FALSE,0.95558643,TRUE,other,TRUE
JUST IN - Florida\'s Gov. DeSantis to sign bills stopping the federal vaccine mandate at a press conference in #Brandon today - media advisory.,"Mekoryuk, Alaska",TRUE,Unknown,FALSE,1.1535645,TRUE,other,TRUE
FDA wants to embargo the documents supporting their Pfizer vaccine approval for 55 years? https://t.co/fQoAIrEx8k,Alaska Range,TRUE,Unknown,FALSE,0.97406054,TRUE,other,TRUE
"Pfizer updated their safety and efficacy trial data, showing more deaths in the vaccine group vs placebo and acknowledges myo/pericarditis “serious risks”  See thread below… https://t.co/aFDZzZIRdz","Alaska, USA",TRUE,Unknown,FALSE,0.9639852,TRUE,other,TRUE
"BREAKING: DeSantis will sign bills against Biden’s vaccine mandates in Brandon, Florida   Troll level: MASTER 😂","Ketchikan, Alaska",TRUE,Unknown,FALSE,1.2333287,FALSE,other,FALSE
"Apparently, Ventavia didn\'t read the story: ""Jackson has provided The BMJ with dozens of internal company documents, photos, audio recordings, and emails."" https://t.co/eovh8Z6vPU Here\'s Ventavia\'s Mercedes Livington invited Jackson a ""clean up call"" on Pfizer\'s clinical trial /2 https://t.co/fKn3x8NgGP","King Cove, Alaska",TRUE,Unknown,FALSE,1.4913975,FALSE,other,FALSE
"$PROG Abbvie and Pfizer partnership, Marketbeat leaked the truth. https://t.co/8USAzCgX0X https://t.co/oNpyiGdOCX","North Pole, AK",TRUE,Unknown,FALSE,1.2327669,FALSE,other,FALSE
"To beat #COVID19, we need more vaccinations, and we know mandates work. It’s time for business -- @NRFnews @NFIB @USChamber @BizRoundtable -- to take the lead. Support the new @OSHA_DOL rules. Better yet, start instituting mandates now. https://t.co/yzRwkeAQir",Alaska,TRUE,Unknown,FALSE,1.0256808,TRUE,other,TRUE
"I\'ve just had my third jab, along with countless other vaccines over my lifetime. I\'m very \'pro\' vaccine!  I also find lockdowns for the unvaccinated disgraceful and dividing society like that will lead to deep and irreversible scars.  This is not a route we want to go down here.",Juneau AK,TRUE,Urban,FALSE,0.9264866,TRUE,other,TRUE
Dus.. pfizer= 👽 https://t.co/Jbjq0F0GTT,"North Pole, AK",TRUE,Unknown,FALSE,1.4575344,FALSE,other,FALSE
Our @HollandHart #HealthLaw attorneys address some of the top questions concerning religious exemption requests under the #CMS COVID-19 vaccine mandate. #COVID19 #VaccineMandate. https://t.co/2RvPCColW0 https://t.co/4CwKsFvUAG,"AK, CO, DC, ID, MT, NM, NV, UT, WY",TRUE,Unknown,FALSE,1.1057477,TRUE,religious_framing,TRUE
"@sushi_roll321 I got the Moderna booster in the trials. Was whiney for about 12 hours. Hubs got J&amp;J first, the the Pfizer booster, a headache the next day, that was it.","NC, AK, CA",TRUE,Unknown,FALSE,1.5059115,FALSE,other,FALSE
"Ovo je Srbija u kojoj zelim da zivim! Ovo je nasa majka Srbija, savremena, moderna drzava, u kojoj se gradi, radi, stvara!  Zahvaljujuci Vucicu imamo nove autoputeve, nove bolnice, fabrike, sigurne plate, omladina ostaje i formira porodicu tu u svojoj zemlji!","Čačak, Srbija",TRUE,Unknown,FALSE,1.8070664,FALSE,other,FALSE
I\'ve always said vaccine mandates are great policy but didn\'t know they were this great https://t.co/24z73wscVk,"Anchorage, AK",TRUE,Urban,FALSE,0.8292773,TRUE,other,TRUE
"Anti-vaccine mandate bills can also be described as: pro-disease bills, pro-suffering bills, pro-death bills, anti-economic recovery bills and pro-inflation bills. https://t.co/pG5nl2AUO8","Alaska, USA",TRUE,Unknown,FALSE,1.1174495,TRUE,other,TRUE
2/ I will not feel guilty for saying no. On Monday I had another coworker claiming that our state was being sued due to the vaccine mandate. She is an anti vaxxer. I told her that the law suit wouldn\'t work because POTUS George Washington mandated vaccines in 1777. Coworker then https://t.co/WVcM63gqaq,Alaska....the only place...*S*,TRUE,Unknown,FALSE,0.9985353,TRUE,other,TRUE
Why did the government temporarily shut down the Johnson &amp; Johnson vaccine? Why has it been so hostile toward possible treatments...except Remdesivir? It makes a lot more since now... https://t.co/GUhKbugPMK,"Alaska, USA",TRUE,Unknown,FALSE,0.9172993,TRUE,other,TRUE
"I\'ve said it before and I\'ll say it again: Biden\'s vaccine mandates are UNCONSTITUTIONAL.   Don\'t get complacent, we must keep fighting Biden\'s tyrannical push to force vaccinations on the American people. https://t.co/W8Tx4KYjaz","Alaska, USA",TRUE,Unknown,FALSE,0.95453286,TRUE,other,TRUE
"U.S. Military Deaths in Vietnam 1961-1975 58,209  Florida Coronavirus Deaths 2020-2021 60,846  The only people being trolled by Gov. Ron DeSantis are his faithful constituents loling all the way to the grave.  https://t.co/6gdKje4cS5","Fairbanks, Alaska",TRUE,Urban,FALSE,1.1377463,TRUE,other,TRUE
@AdamSchefter Antonio Brown’s vaccine card https://t.co/y0Z5sIPvwp,"Alaska, USA",TRUE,Unknown,FALSE,1.1167779,TRUE,other,TRUE
"U.S. Military Deaths in Vietnam 1961-1975 58,209  Florida Coronavirus Deaths 2020-2021 60,846  The only people being trolled by Gov. Ron DeSantis are his faithful constituents loling all the way to the grave.  https://t.co/6gdKje4cS5","Anchorage, AK",TRUE,Urban,FALSE,1.1377463,TRUE,other,TRUE
"EXCLUSIVE: Bucs receiver Antonio Brown obtained a fake COVID-19 vaccination card to avoid NFL protocols, according to his former live-in chef.  Read @NFLSTROUD\'s report: https://t.co/OR91PjPsSk https://t.co/jMIECaFqTP","Dena’ina land, AK",TRUE,Unknown,FALSE,1.0867581,TRUE,other,TRUE
Politicizing a vaccine during a pandemic has to be the worst thing @GOP has ever done. Did they protest the Polio vaccine? Did they protest MMR? Whooping cough? People have been working on SARS vaccines for 30 yrs. WTF?,Alaska,TRUE,Unknown,FALSE,0.8359177,TRUE,other,TRUE
@777DEAN777 Find a new job. Republicans have been complaining there\'s a worker shortage...should be easy to find a new one for anyone afraid of a vaccine their employer requires.  Thought conservatives were *for* businesses having the right to run a business the way they decide.,Alaska ,TRUE,Unknown,FALSE,0.99658334,TRUE,other,TRUE
@4Patrick7 I don\'t like he\'s ignoring the reality of Vaccine either. The funny thing is they made it out like all they did was cut through the red tape to develop a vaccine quickly. We thought it was going 2 be like other Vaccines except a priority to develop. It was ready to go before that,"Alaska, USA",TRUE,Unknown,FALSE,0.7932278,TRUE,other,TRUE
We just banned public AND private vaccine passports!,Alaska,TRUE,Unknown,FALSE,0.87150526,TRUE,other,TRUE
We just banned public AND private vaccine passports!,alaska,TRUE,Unknown,FALSE,0.87150526,TRUE,other,TRUE
"California and Florida are now head to head in all-cause excess mortality.  Florida remained open and maintained normalcy, while California was under the tyranny of lockdowns, school closures, mask- &amp; vaccine mandates...  #Covid #Covid19 #Corona #Coronavirus https://t.co/gfJG2KRmDp","Anchorage, AK",TRUE,Urban,FALSE,1.1914425,TRUE,other,TRUE
FDA Wants Until 2076 To Fully Release Pfizer Vaccine Data: Lawsuit  https://t.co/KLuo3tOtmp,"Fairbanks, Alaska",TRUE,Urban,FALSE,0.91900015,TRUE,other,TRUE
รีวิวฉีดวัคซีน Pfizerฟรี! แบบwalk in ที่สนามchang arenaบุรีรัมย์ ไม่ใช่ภูมิลำเนาบุรีรัมย์ก็ไปฉีดได้มีจนทจัดแถวจัดคิวเราไปถึงเกือบ8โมงได้ฉีด11โมงคนค่อนข้างเยอะแต่จนทจัดการดี มีน้ำเปล่าให้หยิบฟรี เป็นไฟเซอร์ทั้งหมด2เข็ม งงว่าจ.อื่นทำไมมีแต่ไขว้ คนไทยทุกคนควรได้ไฟเซอร์2เข็มป่าว🥲🥲 https://t.co/6YXEXO8KF8,"Alaska, USA",TRUE,Unknown,FALSE,1.831458,FALSE,other,FALSE
The Road To Fascism: Paved With Vaccine Mandates And Corporate Collusion https://t.co/r3vCYiBGzW,"Alaska, USA",TRUE,Unknown,FALSE,0.8864871,TRUE,other,TRUE
"Peter Navarro: ""I never imagined that the vaccine would be used as a weapon against workers. It\'s the stupidest damned thing I\'ve ever heard."" https://t.co/TmnzZRihXX","Alaska, USA",TRUE,Unknown,FALSE,1.0229682,TRUE,other,TRUE
@charlesbrew I\'m a loyal swing vote; though 80%+ of my votes have been D. I was about ready to hand them my lifetime membership after The Orange Menace but HOLY F*** CAN THINGS GET WORSE THAN HIM.  Dude never disobeyed a court order; but 9 months into Team Blue...  https://t.co/1kiYkPMzNr,Bulgaria or Alaska or Texas,TRUE,Unknown,FALSE,1.7452304,FALSE,other,FALSE
Completely outrageous.   Want people to get vaccinated? The FDA needs to be transparent so people can make an informed decision.  https://t.co/rmPpyg4hzQ,Alaska,TRUE,Unknown,FALSE,0.929896,TRUE,other,TRUE
"Just couldn’t do another video about all of the unvaxxed COVID patients I saw today. &amp; the lack of beds. &amp; how they all want monoclonal antibodies. Without more vaccine mandates, please tell me how we get out of this. Make them required for every damn thing people want to do.","Denali, Alaska U.S.A.",TRUE,Unknown,FALSE,0.8415861,TRUE,other,TRUE
@LavellesBistro So no vaccine no service? You do realize the vaccinated can still contract covid and spread it.,alaska,TRUE,Unknown,FALSE,0.94470024,TRUE,other,TRUE
The FDA wants the public to wait until the year 2076 - a full 55 years - for them to release the information it relied on to deem Pfizer\'s vaccine safe for usage.  They said they can release 500 pages a month for the next 659 months.  That makes me want to see the data right now.,"Anchorage, AK",TRUE,Urban,FALSE,1.082381,TRUE,other,TRUE
🚨NHS vaccine website crashes as 10s of thousands of brits scared out of their mind rush to schedule booster injections as Boris warned of an incoming \'Tidal Wave\' of Omicron https://t.co/zv5zJGfTCB,"Alaska, USA",TRUE,Unknown,FALSE,0.9299431,TRUE,other,TRUE
"They were let go from the nation’s second-largest district for ""non-compliance with the district’s vaccine requirement.""   The district said vaccination is a condition of employment, and employees who do get vaccinated may be eligible for rehire.   https://t.co/93hNbduxTM","Alaska, USA",TRUE,Unknown,FALSE,1.0639144,TRUE,other,TRUE
"“So, our plan is to be honest with Americans. About 30% of Americans right now have chosen not to get the vaccine. But what the biggest impact would be right now is to get boosters into seniors,...""  https://t.co/zaqj0X6K7r","Alaska, USA",TRUE,Unknown,FALSE,0.8327005,TRUE,other,TRUE
Do Covid-19 vaccine mandates for those who have had Covid make sense? https://t.co/28GxDgrPHA,"Alaska, USA",TRUE,Unknown,FALSE,0.9210416,TRUE,other,TRUE
"Ο ΠΘ της Βουλγαρίας B. Borissov, αποκάλυψε  οτι τον Απρίλη υπογράφτηκαν συμβόλαια για 900 εκ. εμβόλια με υψηλότερη τιμή (19,5 *δοση!), για παράδοση το 2022 και 2023..!!!  Δεν είναι επιστήμονες, είναι μελλοντολόγοι  που συμμετέχουν σε λεηλασία.  https://t.co/hC28o58Ml0",Alaska,TRUE,Unknown,FALSE,1.740448,FALSE,other,FALSE
"@JeffLandfield I\'ve been in Hawaii for 4 days and have not been required to provide a COVID test or vaccine card to enter any business, point of interest or activity so far outside of uploading my vaccine card to safe travels to get through the airport.","Anchorage, AK",TRUE,Urban,FALSE,1.2744102,FALSE,other,FALSE
"Boris Johnson is facing what could be the largest rebellion of his premiership this week, with almost 70 Tory MPs reportedly against the imposition of extra coronavirus measures https://t.co/jrXQxxWw4d","Alaska,South Central",TRUE,Unknown,FALSE,1.5197031,FALSE,other,FALSE
"7-day average of new covid cases:  New York City, with vaccine passport: 2,950  Florida, with no restrictions: 1,941",Alaska,TRUE,Unknown,FALSE,1.1817662,TRUE,other,TRUE
"BREAKING REPORT: Elon Musk named Time Magazine\'s 2021 Person of the Year, despite SLAMMING VACCINE MANDATES for \'erosion of freedom\' and – Calling on Congress to THROW OUT Biden’s ‘Build Back Better Bill’ – “Don’t Pass It”..","Sitka, AK",TRUE,Urban,FALSE,1.2141087,FALSE,freedom_language,FALSE
"Would the people who support government vaccine mandates, mask mandates, lockdowns, etc. also support the government requiring citizens to jog for 45 minutes a day? Tracked by an app. Don’t do it? Healthcare prioritized for those who do? Or would that be too intrusive?","Anchorage, AK",TRUE,Urban,FALSE,0.93030834,TRUE,other,TRUE
@Max_Galtman @connortryan PS whooping cough and tetanus haven\'t been wiped out either but you still get a vaccine for them unless you\'re one of those losers that practices crystal healing,"Anchorage, AK",TRUE,Urban,FALSE,1.0014455,TRUE,other,TRUE
I\'m more than happy to trust the science!  Science is awesome  They haven\'t released the science though so there\'s nothing to trust  https://t.co/jDZTtqluIP,"Anchorage, Alaska",TRUE,Urban,FALSE,1.5959681,FALSE,other,FALSE
BREAKING: The Supreme Court declines to block the NY vaccine mandate that does not have religious exemptions. So much for religious freedom.,Alaska,TRUE,Unknown,FALSE,0.9904053,TRUE,religious_framing,TRUE
"Ages 16 and 17 can now get a COVID-19 booster. @CDCgov has expanded its recommendation, saying 16- and 17-year old can get a Pfizer booster 6 months after their initial Pfizer series. Here\'s who\'s providing them in Juneau: https://t.co/JcVBQzJjUo","Juneau, AK",TRUE,Urban,FALSE,1.45291,FALSE,other,FALSE
"In den USA hat ein Gericht angeordnet, dass die Studiendaten zur Genspritze veröffentlicht werden müssen. Pfizer wußte von den schwerwiegenden Nebenwirkungen und Todesfällen #Impfpflicht #Impfschaeden #coronaprotest #COVID19 #CoronaPandemie #Corona https://t.co/19gwTbsJHY",Unna-Uşak-Charleston,TRUE,Unknown,FALSE,1.3834137,FALSE,other,FALSE
FLASHBACK: Fauci suggests that the COVID-19 vaccine could leave people more likely to be infected. https://t.co/7G83lmat5P,"Alaska, USA",TRUE,Unknown,FALSE,0.91009474,TRUE,other,TRUE
@DermotMCole @ltgovmeyer That free vaccine that they could have received at home?,"Anchorage, AK",TRUE,Urban,FALSE,0.98235416,TRUE,other,TRUE
"More log-scale graphs instead of linear ones—with the proper explanation—and replacing relative measures like “vaccine efficacy” with other ways of conveying the same information would really help, in my view. Matching method of communication to what it needs to express matters. https://t.co/nQIVVpgRSe","Alaska, USA",TRUE,Unknown,FALSE,1.6332479,FALSE,other,FALSE
"February, 2020. Were they wrong? https://t.co/m1oSl7aAfF https://t.co/ib9RPBqCmQ","Fairbanks, AK",TRUE,Urban,FALSE,1.5436054,FALSE,other,FALSE
"NEW -- As the pandemic raged, at least 75 lawmakers bought and sold stock in companies (Pfizer, Moderna, J&amp;J) that make COVID-19 vaccines, treatments, and tests, Business Insider reports.","Alaska, USA",TRUE,Unknown,FALSE,1.1867346,TRUE,other,TRUE
"I held back on saying much about Time selecting Elon Musk as person of the years until I read their reasoning. In a year when the developers of the mRNA vaccines have saved millions and helped restore global economies, the selection of Musk this year may be the worst choice ever.","Anchorage, AK",TRUE,Urban,FALSE,1.2978024,FALSE,other,FALSE
"NEW -- As the pandemic raged, at least 75 lawmakers bought and sold stock in companies (Pfizer, Moderna, J&amp;J) that make COVID-19 vaccines, treatments, and tests, Business Insider reports.","Alaska, USA",TRUE,Unknown,FALSE,1.1867346,TRUE,other,TRUE
"@akartisan In Juneau CBJ is giving them away @ libraries, City Hall, the airport, and any vaccine clinic site, and adding new sites.","Juneau, Alaska\'s capital city",TRUE,Urban,FALSE,1.2150099,FALSE,other,FALSE
"NEW -- As the pandemic raged, at least 75 lawmakers bought and sold stock in companies (Pfizer, Moderna, J&amp;J) that make COVID-19 vaccines, treatments, and tests, Business Insider reports.","Alaska, USA",TRUE,Unknown,FALSE,1.1867346,TRUE,other,TRUE
FLASHBACK: Fauci suggests that the COVID-19 vaccine could leave people more likely to be infected. https://t.co/7G83lmat5P,"North Pole, Alaska",TRUE,Unknown,FALSE,0.91009474,TRUE,other,TRUE
"JUST IN: The Supreme Court has turned away two emergency requests from health care workers, doctors and nurses in New York to block the state\'s vaccine mandate. Justices Samuel Alito, Neil Gorsuch and Clarence Thomas dissented. https://t.co/zdePQrOYeI","Anchorage, AK",TRUE,Urban,FALSE,1.1138611,TRUE,other,TRUE
"Ireland 🇮🇪 is 95% vaccinated, they wear masks all the time,  they check vaccine cards in restaurants, and no one complains. Fox has long been banned. What the hell is wrong with the U.S.A. ?",Alaska,TRUE,Unknown,FALSE,1.009138,TRUE,other,TRUE
"Ireland 🇮🇪 is 95% vaccinated, they wear masks all the time,  they check vaccine cards in restaurants, and no one complains. Fox has long been banned. What the hell is wrong with the U.S.A. ?",Alaska ,TRUE,Unknown,FALSE,1.009138,TRUE,other,TRUE
how u gonna do drugs but be scared of a vaccine,AK,TRUE,Unknown,FALSE,0.9343252,TRUE,other,TRUE
"As the headlines start to pour in on waning vaccine effectiveness against Omicron, please remember:   These vaccines are best at keeping you out of hospitals and ICUs, not preventing a positive test or mild symptoms.   Please take the headlines with a large grain of salt.",Alaska,TRUE,Unknown,FALSE,1.1861829,TRUE,other,TRUE
"@mcmillen @TheOmegaGeek Imagine explaining it to future people. ""So the huckster got himself into the white house with racism &amp; did a terrible job, and then one of the greatest country-singers of all time helped pay to develop a vaccine to a terrible plague with research from a furry.""",Alaska,TRUE,Unknown,FALSE,1.1351758,TRUE,other,TRUE
"Pick up line of the week:  Hey girl, your last name must be Pfizer, cause you just made my heart stop.","Anchorage, AK",TRUE,Urban,FALSE,1.5822146,FALSE,other,FALSE
"BREAKING REPORT: Multiple Hospital Groups Including [HCA Healthcare, Tenet Healthcare Corp, AdventHealh and the Cleveland Clinic] are now TOSSING COVID-19 VACCINE MANDATES to Ease Labor Shortages..","Anchorage, AK",TRUE,Urban,FALSE,0.8874546,TRUE,other,TRUE
The Moderna &amp; Pfizer &amp; all other covid vaccines are being used to CAUSE the \'pandemic\' to continue indefinitely as part of TPTB &amp; WEF global depopulate the humans agenda.,"Alaska, Idaho, Costa Rica",TRUE,Unknown,FALSE,0.869532,TRUE,other,TRUE
"Listen to what they\'re saying. Take a vaccine, any vaccine. Take 1 dose. Take 2 doses. Take the doses two weeks apart. Mix and match vaccines. Take the doses whenever you want. Get a booster. Take it before you get sick. Take it if you\'re sick. There\'s no limit to the absurdity.","Alaska, USA",TRUE,Unknown,FALSE,0.947984,TRUE,other,TRUE
"@MollyJongFast I\'ve had to provide my vaccine status to every hospital and medical clinic at which I worked for the last 40 years. Not ONE has ever asked about my DNA.   The only ""slippery slope"" is her grasp of reality.",Alaska,TRUE,Unknown,FALSE,0.7062361,TRUE,other,TRUE
"Thousands of people protest in Rome to call for an end to the draconian restrictions, vaccine passports and no jab, no job enforcement in Italy. 🇮🇹  https://t.co/QI1AwKwzuG","Alaska, USA",TRUE,Unknown,FALSE,1.260821,FALSE,other,FALSE
"When Stephen Colbert was talking about Pfizer’s new Covid drug, he said that most of the people who would need it would be anti-vaxxers, &amp; that they would have to actually take it for it to work…  “So the administration has renamed it to: Dr. Lindell’s Magic Horse Elixir”. 🤪 💊","Anchorage, Alaska, USA",TRUE,Urban,FALSE,1.2174555,FALSE,other,FALSE
"3 days after this German doctor recorded his confession, he was found dead..... This must be investigated...  Germany | Dr Thomas Jendges Head of Clinic, Commits ""Suicide""..  “COVID-19 Vaccine Is a Genocide”  https://t.co/XWA8uJxrcv https://t.co/j9dTBtc0mP","Alaska, USA",TRUE,Unknown,FALSE,1.079087,TRUE,other,TRUE
"Under Joe Biden, more people died WITH Covid in 2021 than 2020, in spite of THREE vaccines that weren’t available in 2020 and FIVE (bogus) vaccine mandates issued by Joe Biden in 2021. https://t.co/YK1IzbjhVi",Alaska,TRUE,Unknown,FALSE,0.6972387,TRUE,other,TRUE
My grandson was just stillborn at a Vancouver hospital at 8 1/2 months into the pregnancy. My daughter got the damned poison vaccine one month ago because she couldn’t go to restaurants and people were freaking that she was unvaxxed. I want to sue the government,"Alaska, USA",TRUE,Unknown,FALSE,1.0883565,TRUE,other,TRUE
@THOMASWGRIFFIN1 @RoystonPotter @ttttt55555pppp5 @ExitEmergency29 youre the one spinning that narrative although i agree trumps pfizer first policy is terrible,"Alaska, USA",TRUE,Unknown,FALSE,1.1924793,TRUE,other,TRUE
I hate Big Pharma EXCEPT for Pfizer https://t.co/lptKIwvUcf,Alaska,TRUE,Unknown,FALSE,0.8297057,TRUE,institutional_distrust,TRUE
No babe we had Moderna last time I wanna try that new Pfizer one https://t.co/xG6JIGQmKR,"Kenai, AK",TRUE,Unknown,FALSE,1.657408,FALSE,other,FALSE
Federal health officials hope a straightforward boosters-for-all policy will prompt millions more people to get the shots before they travel or gather with friends and family over the holidays. https://t.co/jTuH8iguDN,"Anchorage & Juneau, Alaska",TRUE,Urban,FALSE,1.0488151,TRUE,other,TRUE
"If you don’t get the #COVID19 vaccine in Singapore, you have to pay for your own hospitalization. But since Singapore 🇸🇬 has free universal healthcare, they’re saying “we are going to treat you like an American—which is the biggest punishment you can give someone” ~@ronnychieng😳 https://t.co/QokKV8SADV",Alaska,TRUE,Unknown,FALSE,1.1396925,TRUE,other,TRUE
"Have You Been the Victim of a Vaccine Mandate? If So, You May Be Entitled https://t.co/Db0n2gIlBn https://t.co/jV6tyF5Urv","Anchorage, ak",TRUE,Urban,FALSE,0.9079392,TRUE,other,TRUE
